,comment_id,comment_parent_id,comment_body,comment_link_id
819,fxfsoyx,t3_ho4otc,"More like made me bawl like a baby, but still so wonderful.",t3_ho4otc
820,fxftxui,t3_ho4otc,At work on my lunch break trying not to blubber. I love this.,t3_ho4otc
821,fxfw1qu,t3_ho4otc,omg what is this salty liquid coming from my eyes???,t3_ho4otc
822,fxfs7x9,t3_ho4otc,"Thanks, my son’s crying now",t3_ho4otc
823,fxftcb9,t3_ho4otc,"I'm not crying , you're crying.......",t3_ho4otc
824,fxftda8,t3_ho4otc,More like r/mademecryatwork. What the hell.,t3_ho4otc
825,fxg0a42,t3_ho4otc,"You may not be able to change the world, but you may be able to change enough peoples’ worlds’ to make a change, somehow someway :) This is a prime example of such a phenomenon which some may coin with the term karma☯️ be the change you’d like to see in the world",t3_ho4otc
826,fxfqqkv,t3_ho4otc,No you're crying!,t3_ho4otc
827,fxfr2ad,t3_ho4otc,MadeMeSmile? More like MadeMeCry. That is so beautiful.,t3_ho4otc
828,fxfs6wp,t3_ho4otc,I'm not crying you're crying,t3_ho4otc
829,fxfs6wu,t3_ho4otc,Tears.,t3_ho4otc
830,fxfstyx,t3_ho4otc,Im gonna find that stupid ninja cutting those onions I swear....,t3_ho4otc
831,fxfswl2,t3_ho4otc,"Is there a ""made me tear up a bit"" subreddit?",t3_ho4otc
832,fxft0er,t3_ho4otc,Made me cry! This is so touching.,t3_ho4otc
833,fxft3wn,t3_ho4otc,Didn’t know I was stepping into the onion chopping factory today.,t3_ho4otc
834,fxft7sp,t3_ho4otc,Made me smile-cry,t3_ho4otc
835,fxftlh4,t3_ho4otc,Made ME cry,t3_ho4otc
836,fxftniq,t3_ho4otc,okay i didnt come on Reddit to cry but here i am. You never realize how something as simple as giving someone a haircut can mean the world to them! This is such a nice message,t3_ho4otc
837,fxftpjw,t3_ho4otc,Who’s cutting onions!!??,t3_ho4otc
838,fxftps9,t3_ho4otc,That made me tear up.,t3_ho4otc
839,fxfuj90,t3_ho4otc,"I’m not crying, you’re crying...",t3_ho4otc
840,fxfuoak,t3_ho4otc,"Well, this didn't make me smile. I'm crying",t3_ho4otc
841,fxfup5j,t3_ho4otc,"I'm not crying, you're crying!",t3_ho4otc
842,fxfutrn,t3_ho4otc,Actually brought a tear to my eye,t3_ho4otc
843,fxfuwzt,t3_ho4otc,I'm not crying you're crying,t3_ho4otc
844,fxfvud1,t3_ho4otc,I didn't wanna cry,t3_ho4otc
845,fxfvwet,t3_ho4otc,I don't enjoy crying at work,t3_ho4otc
846,fxfvzpc,t3_ho4otc,"Well fuck.. now I'm crying at work. I thought this was supposed to make me smile, not happy cry. Lol",t3_ho4otc
847,fxfw187,t3_ho4otc,Damn someone better stop cutting onions in here already 😭,t3_ho4otc
848,fxfw45x,t3_ho4otc,That is wonderful. I’m crying anyway,t3_ho4otc
849,fxfw56r,t3_ho4otc,"Cutting those damn onions again. 

So sweet that such a simple thing for one person made the day of another which was then paid forward by his letter 💗",t3_ho4otc
850,fxfupwc,t3_ho4otc,I didn't realize this was r/MadeMeCry,t3_ho4otc
851,fxfvg9s,t3_ho4otc,😊,t3_ho4otc
852,fxfvgo0,t3_ho4otc,More like r/mademecry,t3_ho4otc
853,fxfrp1j,t3_ho4otc,"This makes me a little bit sad, thinking of how bad they had treated them before, or just plain refused to cut her hair, for them to pay so much attention on someone who, of course is very nice and human and deserves recognition, but in the end treated this old lady with the dignity she deserved (and nailed that haircut for what I can sense!)",t3_ho4otc
854,fxfsnu8,t3_ho4otc,Damn you for making a grown man cry,t3_ho4otc
855,fxfommy,t3_ho4otc,This made me so emo OH GOD,t3_ho4otc
856,fxfu8mh,t3_ho4otc,"I'm not crying, you are.",t3_ho4otc
857,fxfx5y9,t3_ho4otc,"Can we get a made me smile sub that makes me smile, instead of tearup? 

So tired of this obvious emotional bait that keeps this from actually being a place to come SMILE.",t3_ho4otc
858,fxgct79,t3_ho4otc,Shitty,t3_ho4otc
859,fxfvkoc,t3_ho4otc,Fuck.,t3_ho4otc
860,fxfr6uc,t3_ho4otc,[deleted],t3_ho4otc
861,fxfi1tj,t1_fxfgqrf,"I know! Something that may seem like no big deal could really make a difference for someone else. With all that’s going on in the world, this made me happy to see :)",t3_ho4otc
862,fxfqoid,t1_fxfgqrf,"One of the only pieces of feedback I've ever given to a business was to my hair stylist.  I was going through a really rough time and she made me feel so good about myself.

I wish I could see her again, but COVID has stymied our attempts.",t3_ho4otc
863,fxfujbb,t1_fxfgqrf,[removed],t3_ho4otc
864,fxftd2x,t1_fxfgqrf,"My job makes a big deal anytime we get any praise from a customer the CEO sends an email to all employees showing the praise and giving kudos. Anytime you get good service send a quick email, it makes a huge difference at alot of jobs especially when it comes review time. I got one the other day and was so excited but she disparaged another rep who didnt do as well so they didnt send it out :(",t3_ho4otc
865,fxfs16k,t1_fxfgqrf,"Agreed, I always try to do this! Even ask for surveys on customer service calls or chats so I can give positive feedback 😀",t3_ho4otc
866,fxfydsb,t1_fxfgqrf,"I still remember this sweet little old lady that made sure to tell my manager in front of me what a great job I was doing and how they were lucky to have me.

I was 14 and it was a month into my first job at Tim's (coffee shop) on a day when we were short staffed and it was super busy. Horrible day but that one comment just absolutely made my day and is something I still fondly remember 15 years later.",t3_ho4otc
867,fxfwb5a,t1_fxfgqrf,"I can’t count the number of positive experiences where a customer was so happy and was going to call the company to leave a great review of my work. 

I however CAN count the number of those people who actually followed through.",t3_ho4otc
868,fxfvm95,t1_fxfgqrf,It's small but that's why I've been trying to leave more positive online reviews for services and businesses that I use. I figure now more than ever they could use good word of mouth.,t3_ho4otc
869,fxg2bb1,t1_fxfgqrf,A person will tell 2 people about a positive experience and 20 people about a negative.,t3_ho4otc
870,fxg7fxj,t1_fxfgqrf,Can we all agree to write more praise than criticism? I think we’d all feel better.,t3_ho4otc
871,fxg0igk,t1_fxfgqrf,I worked in retail pharmacy for 19 years. I have a box with every single note and card someone gave me. It always made my day.,t3_ho4otc
872,fxfzd15,t1_fxfgqrf,I have worked in a callcentre and in a public library. I make it a point to email corporate shops when i had a good experience or i notice someone doing a great job. It’s really fun to do. If it’s a small place i compliment the owner.,t3_ho4otc
873,g0ymtwi,t1_fxfgqrf,This is so true. I try to go out of my way to say nice things. I call the restaurant manager for a great waiter and leave good reviews when I have a nice customer service experience. I think we should all try to spread a little more kindness,t3_ho4otc
874,fxfz1lr,t1_fxfgqrf,"At first I read ""Dear Santa"" and it made the rest of the letter really confusing.",t3_ho4otc
875,fxg1os0,t1_fxfgqrf,I moved 600 miles away from home but I still get my hair cuts from the same barber shop back home because the dudes there do the best haircuts Ive ever had. Ive never told them I would rather travel 10 hours to get my hair cut (and visit family oc) from them rather than get a shit cut in the town I now live in because it seems unprofessional.,t3_ho4otc
876,fxg3xku,t1_fxfgqrf,"I managed an IT help desk for years, and I can tell you that 75% of the comments you get are negative. Ever since that job, I go out of my way to compliment exemplary service, no matter where it's received.",t3_ho4otc
877,fxg65ef,t1_fxfgqrf,"I learned from a great boss, that when you receive good service,  let the person (and the manager if possible) know. It's amazing how little they get to hear positive praise from those that they serve and enormously it can make their day. My husband and I make sure we do this when we can and we've had some of the best conversations and memorable experiences because of it.",t3_ho4otc
878,fxg65op,t1_fxfgqrf,"Yes, my rule is no negative review unless 2 or ideally 3 bad experiences back to back.",t3_ho4otc
879,fxg9fag,t1_fxfgqrf,"A woman came into the deli I cooked for to let me know that the soup I'd made a few days earlier was the last meal her mother ate. She said her mother hadn't been eating anything towards the end, but she loved the soup and it helped her get a little stronger at the end. I was only 17 at the time and it blew me away that something I did had impacted a person's last moments on earth.",t3_ho4otc
880,fxg9iko,t1_fxfgqrf,"There was a guy who was leaving all sorts of positive comments on my music on SoundCloud years ago.  I found him on FB and thanked him for all his support, and he was absolutely star struck.  I was like “dude, you’re my only fan.”  LOL.  Really appreciate positivity in a world that loves to shit on people’s creativity.",t3_ho4otc
881,fxgbu03,t1_fxfgqrf,"I agree there is so much hostility thrown at hospitality and retail workers as if doing these jobs somehow gives them a lower station in life. These are the people that deserve our gratitude the most, the jobs they do literally nourish our mind, body, and sole. A librarian helping you find a book. A waiter suggesting the perfect meal, Or a hairdresser who makes you feel like a million bucks. Some people think well it's there job, Well it is. they could have gotten a job where they do not work with the public but instead they chose to help people. So I think take this letter as inspiration. When someone dose something that has a positive impact on you no matter what its acknowledge the person and what they did.",t3_ho4otc
882,fxgg0m7,t1_fxfgqrf,"that's why treating four star reviews/ratings (or whatever the maximum is) like the ""default"" is kind of dumb (with everything getting less than those being considered ""bad"").",t3_ho4otc
883,fxgkoe7,t1_fxfgqrf,I hope Sara got a great tip!,t3_ho4otc
884,fxgksu1,t1_fxfgqrf,"I worked guest relations at six flags one summer, and about 99% of the job was listening to customers complaining about relatively small stuff, but I don’t remember anything specific. What I do remember were the maybe 5 instances that a family stopped by on their way out to share how much fun they had that day. It was amazing, really.",t3_ho4otc
885,fxgnsp0,t1_fxfgqrf,"When someone does well, I always try to tell them and their supervisors/corporate if there is one just to balance out all the negativity in the world. My son has special needs and going out to do simple things is harder than you would think. If someone shows patience and kindness or goes out of their way to help us, you can bet I will tell them how I appreciate and tip like I mean it (like $20 on a $13 haircut for $33 total). I feel like that drives home the point that the kindness and empathy they showed is as rare as it is appreciated.",t3_ho4otc
886,fxgrkg2,t1_fxfgqrf,"My wife took me to try the burgers at this place a couple towns over. She kept talking about how good all of the food was, and I'm a sucker for a good hamburger. Let me tell you - best burger I've had in a long time, possibly ever. I finished the first bite and had to call this dude and let him know I had a damn near spiritual experience eating his food. It definitely caught him off guard because he started laughing and said, ""Man, I was thinking something was wrong with your order."" We had a good laugh and I reassured him I just wanted to let him know he's got some damn good grill skills.",t3_ho4otc
887,fxgvdkx,t1_fxfgqrf,People whisper your accomplishments and scream your failures.,t3_ho4otc
888,fxgxzl9,t1_fxfgqrf,"It’s for this reason alone that I always leave a little note for servers/bartenders. I used to be a bartender and I remember how a shitty day would be instantly made just by a scribbled little “thank you, you were awesome, great service,” etc. It always (100% of the time) makes them smile.",t3_ho4otc
889,fxh2m3a,t1_fxfgqrf,"Right now our business is adapting to working through Covid and the one really positive review we got the other day made me completely disregard the negative ones. It's so simple to be nice and understanding, but people too often choose negativity.",t3_ho4otc
890,fxhji3d,t1_fxfgqrf,My mom is like a reverse Karen. She frequently talks to managers to tell them an employee is doing a great job.,t3_ho4otc
891,fxicn3t,t1_fxfgqrf,THIS😭,t3_ho4otc
892,g0yfya3,t1_fxfgqrf,This is why it’s always important to say GG at the end of a game,t3_ho4otc
893,fxfmmxt,t1_fxfgqrf,[deleted],t3_ho4otc
894,fxfs19p,t1_fxfhghz,Exactly. You never know what someone is going through. Such little nice things cost nothing yet make someone's day beautiful.,t3_ho4otc
895,fxg4yij,t1_fxfhghz,"If I could plug in a [TED talk](https://youtu.be/uAy6EawKKME) that talks about this exact thing. How everyone could be oblivious to how their small but positive interactions with people could leave such a great impact. 
They’re called “lollipop moments.”",t3_ho4otc
896,fxfns8i,t1_fxflh0u,"I am not Sara, but she sounds like a wonderful person :) just wanted to share because it made me tear up today!",t3_ho4otc
897,fxfn8ct,t1_fxfl4n5,"It’s kinda sad smiling though, happy tears maybe?",t3_ho4otc
898,fxfsjjp,t1_fxfl4n5,Currently sat in an uber tearing up at this.,t3_ho4otc
899,fxfwy3h,t1_fxfl4n5,r/mademecry,t3_ho4otc
900,fxfowrh,t1_fxfl4n5,Subreddit created,t3_ho4otc
901,fxfmxx7,t1_fxfl4n5,I'm not smiling either 😥,t3_ho4otc
902,fxfux2t,t1_fxfl4n5,We really need to move these to r/itsreallydustyinhere,t3_ho4otc
903,fxfylo6,t1_fxfl4n5,Made me tea ruin the Uber?,t3_ho4otc
904,fxg4lrr,t1_fxfl4n5,"I feel like this is slightly joking, but do people really smile at posts like this? It seriously bums me out when I see a MadeMeSmile post in my feed and it's ""my wife had dementia and died this year"". I get something nice happened in it but it's terribly bittersweet.

I come here for things like wholesome Bob Ross and the banana boy and just general pure and happy things. Is it possible that we could at least tag these tear-jerker posts so that some folks could filter them out when I don't want to be dealing with death and the horrors of the world?",t3_ho4otc
905,fxggd3c,t1_fxfl4n5,[deleted],t3_ho4otc
906,fxghjsx,t1_fxfl4n5,Wait why are you taking an Uber too these days?,t3_ho4otc
907,fxgryl4,t1_fxfl4n5,r/NSFDE (not safe for dry eyes),t3_ho4otc
908,fxfxide,t1_fxfl4n5,"At first I thought you wrote ‘made me rape the Uber’.   
And I was confused.",t3_ho4otc
909,fxg191j,t1_fxfl4n5,Came here to say this,t3_ho4otc
910,fxg2qkp,t1_fxfl4n5,I can’t believe the Uber subreddit is real,t3_ho4otc
911,fxg6btw,t1_fxfl4n5,Is this an r/birthofasub,t3_ho4otc
912,fxgpfwh,t1_fxfl4n5,I feel like 80% of the posts here make me cry lol. This sub is incorrectly named,t3_ho4otc
913,fxfnn9b,t1_fxfl4n5,[removed],t3_ho4otc
914,fxgepdb,t1_fxfwmfi,"If just asked, she would probably not be able to remember you.

If you took her some orange pops and shared them with her on a hot day, she might be able to. ☺",t3_ho4otc
915,fxg7uh3,t1_fxfwmfi,Thank you.,t3_ho4otc
916,fxgz9fh,t1_fxfwmfi,"> It takes nothing to be kind.

I wish everyone would embed this into their souls. Just think about and care for other people a *little* bit and the world would be much better off.",t3_ho4otc
917,fxfri2o,t1_fxfmogz,We all want to feel pretty.,t3_ho4otc
918,fxfxd5m,t1_fxfmogz,Because it was written by a loving grieving husband showing appreciation for genuine kindness. Dementia is a horrible horrible disease. I bet this experience made both husband and wife very happy. My dad has it and he doesn’t get out much because it’s a pain to explain to people that he has dementia and that’s why he’s acting weird.  Being a caretaker for someone with dementia is one of the hardest things ever so positive experiences tend to stick out.  Good on him for sharing his experience with the hairstylist!,t3_ho4otc
919,fxftk0w,t1_fxfmogz,Yeah thats the one that got me too.,t3_ho4otc
920,fxfw9f9,t1_fxfmogz,Someone get these onions outta my face!,t3_ho4otc
921,fxg3qdj,t1_fxfmogz,"I'm a pretty emotionally stunted person, yet this post even made me tear up",t3_ho4otc
922,fxgmf1q,t1_fxfmogz,"It's such a simple, childlike sentence that reminds us that there's still a child inside of us that wants to be loved and feel good about ourselves.",t3_ho4otc
923,fxhcpsv,t1_fxfmogz,"I think part of it is that when reading into the rest of the letter, you get the feeling that she's probably struggled a bit in old age due to dementia.  It's hard on everyone when someone you love starts forgetting things or has wild mood swings, so I bet this was a welcome change & something the widower may not have seen in a while.  That sentence ""one which revitalized a woman's sense of self & her singular beauty"" really stands out when you understand what dementia does to someone's mind.",t3_ho4otc
924,fxg0vxd,t1_fxfmogz,"I am overanalyzing, but the phrase stands out because the author changed their ""cadence"" of writing and ""felt"" is used to re-imply death, when it normally would not.",t3_ho4otc
925,fxfwwt6,t1_fxfmogz,[deleted],t3_ho4otc
926,fxge36k,t1_fxfwhzg,This made me cry just reading it. Not sure how you were able to handle you're composure! Thank you for being so kind and letting her talk to you.,t3_ho4otc
927,fxi0x34,t1_fxfwhzg,You are wonderful!!!!!,t3_ho4otc
928,fxfuh75,t1_fxfkeja,And wholesome >3,t3_ho4otc
929,fxfu40n,t1_fxfmxzy,Literally same,t3_ho4otc
930,fxft1vb,t1_fxfmxzy,Been there so many times,t3_ho4otc
931,fxfxecd,t1_fxfmxzy,the nation's real pass time during the last 3 months.,t3_ho4otc
932,fxg03xn,t1_fxfmxzy,i’m glad we’re all living the same life. y’all just wake up too?,t3_ho4otc
933,fxg6pwo,t1_fxfmxzy,*again*,t3_ho4otc
934,fxgg5d4,t1_fxfmxzy,"Again? Doesn't that sort of imply that there are people who don't cry on the toilet sometimes?  
  
Is that even possible?",t3_ho4otc
935,fxg22u1,t1_fxfzavx,Wow. Imagine saying to yourself that you saved a life. Everything would pale in comparison,t3_ho4otc
936,fxi112h,t1_fxfzavx,❤️❤️❤️❤️❤️❤️❤️❤️❤️❤️❤️❤️❤️❤️❤️❤️,t3_ho4otc
937,fxie1do,t1_fxfzavx,"This story is from the book Life As a Daymaker by David Wagner.
I read it when I first started doing hair and it’s really stuck with me. Highly recommend",t3_ho4otc
938,fxftdol,t1_fxfnmv6,"You DO have that effect on people, i feel so ugly and my hair is my everything, having it cut nice by a nice person always makes my day so much better!",t3_ho4otc
939,fxfsjvg,t1_fxfnmv6,"You have that effect on people too, you know. ;)",t3_ho4otc
940,fxg5lr9,t1_fxfnmv6,"I’m a flight attendant, obviously it’s slightly different. But I will always offer free drinks to military/first responder types, as my roommates are both marines and I feel obligated to take care of those knuckleheads. Anywhoodles, I gave this one kid a couple free whiskies after seeing his USMC shirt. He came to the back and handed me a thank you note. In it he confided that he was going home on grief leave or whatever because the mother of his two children had died that morning, and the simple act of a free drink meant so much. I still have that note tacked to my bedroom wall, and I’ll never forget that dude.  Notes like this definitely keep service industry types going.",t3_ho4otc
941,fxg4u5f,t1_fxfnmv6,"I just sent this to my moms, she's a hair stylist. She's had some clients for a really long time, every now and then one of them passes and she get so sad. Now I see why.",t3_ho4otc
942,fxfuk45,t1_fxfnmv6,Same :'0 I am out of work right now too so it just makes me cry bc I miss these interactions. I love my dementia clients bc I used to be a CNA and feel really comfortable with them. I miss being able to brighten their day and make life feel normal. The times a family member reaches out or before they leave say how much it helped I always go to the back to cry happy tears. I miss my job so much. I miss my clients.,t3_ho4otc
943,fxg7on1,t1_fxfnmv6,I never feel better than when I leave my miracle worker stylist. You make a real difference in people’s lives.,t3_ho4otc
944,fxgqidy,t1_fxfnmv6,"To be fair, a career in hair styling is filled with highlights.",t3_ho4otc
945,fxfndkh,t1_fxfmz9r,"I’m actually not Sara, she sounds awesome though! I just wanted to share this because it made me cry at work today haha.",t3_ho4otc
946,fxg1024,t1_fxg0lud,"I’m not pregnant but I am also crying. Congratulations on your pregnancy, stranger!",t3_ho4otc
947,fxfxv38,t1_fxfw3oe,"When i graduated high school an underclassman I'd been in a play with that year gave me a letter. It wasn't very long, but talked about how kind I'd been to her and how big a difference that had made to her during a tough freshman year. 

I don't think i did anything particularly special for hern and if she hadn't mentioned it I'd have had 0 idea that I'd meant anything to her.

But that letter really shaped how cognizant i was of the effect consistent, casual kindness can have on those we interact with throughout life, and have tried to default to kindness wherever possible. (Always a work in progress).

It also made me realize how special getting thanked is, and made me more likely to let peoplenknow when i was grateful.

 I guess now that i write this i should reach back out and return the favor, letting her know how much her little letter (which she has probably forgotten) shaped my world view.",t3_ho4otc
948,fxfldix,t1_fxfkyea,Glad I wasn’t the only one.,t3_ho4otc
949,fxfvm9r,t1_fxfkyea,Thank god it was not just me.,t3_ho4otc
950,fxg0q47,t1_fxfq7s8,Internet hugs.,t3_ho4otc
951,fxfxsuh,t1_fxfq4m8,"Yes! That is a good word, thank you.",t3_ho4otc
952,fxfri0f,t1_fxfm4c1,r/MadeMeCry,t3_ho4otc
953,fxfpfjo,t1_fxfoz74,My reaction exactly.,t3_ho4otc
954,fxgo95b,t1_fxgmq07,"No I am not, and I’ve tried to make that very clear in the comments. People like this do exist and nice moment such as these happen everyday, so I’m going to give it the benefit of the doubt :)",t3_ho4otc
955,fxgam2m,t1_fxfxlgo,"How hard could it be to write a few lines in word while posing as a deeply moved customer, print it out and post it here? It's too easy.",t3_ho4otc
956,fy1dpd1,t1_fxfxlgo,"Of course it's fake. Even if this was real, imagine the idea of posting this online - how dare you grampa credit me the analog way! This needs to be digital so people from the internet can celebrate me!",t3_ho4otc
957,fxghldm,t1_fxfxlgo,OP isn’t even the hairdresser either lol. All those awards for basically reposting. The Reddit way.,t3_ho4otc
958,fxgtlzg,t1_fxfxlgo,"Ya when I saw sincerely, a grateful customer. I kinda assumed it was fake but it's still nice",t3_ho4otc
959,fxft7nj,t1_fxfsaea,"Not me, I'm here, deal with it",t3_ho4otc
960,fxfxbkj,t1_fxfx6dj,I am not Sara and don’t want to take credit for her awesomeness! I just wanted to share what I felt was a beautiful letter :),t3_ho4otc
961,fxg2nbj,t1_fxg0t2z,"CONGRATULATIONS! You're the 1000th Redditor to reply with that exact sentence!! You can claim your prize via the next-to-last tab in the Preferences section, which is located at the top right corner of the website! Again, congratulations and we hope you'll claim your prize quickly!! Until next time.

\- u/frankank

__________________________________________________

For any questions regarding your prize, please don't.

Thank you.",t3_ho4otc
962,fxiof5s,t1_fxg5urj,I am not Sara and have tried to make that clear in the comments! Sara is certainly a wonderful human and if she sees this I would love to give credit :),t3_ho4otc
963,fxg8ln1,t1_fxg6et2,I am not Sara! Just wanted to share something I found very moving,t3_ho4otc
964,fxg86ka,t1_fxg6kyj,I’m not Sara! I just wanted to share something that really moved me today.,t3_ho4otc
965,fxg7ylj,t1_fxg6m0z,"I am not Sara! Just sharing something I thought was beautiful, especially with everything going on in the world.",t3_ho4otc
966,fxg7rgb,t1_fxg7abg,I have not tried to take credit for this. I have said in multiple comments that I am not Sara and that I simply wanted to share something that made me smile/cry.,t3_ho4otc
967,fxg8rb0,t1_fxg8m2e,I am not Sara! I’m trying to reply as much as possible to make that clear as I do not want credit for something I did not do. Sara is a wonderful human and if (I am assuming she) has a reddit I would happily give her all the credit.,t3_ho4otc
968,fxgcgzt,t1_fxgag8y,"Yeah, maintenance should really get up there to fix that hole in the roof.",t3_ho4otc
969,fxgfd4m,t1_fxgeusa,Thank you for that! But I do want to make it clear I’m not Sara and I’m not trying to get people to give awards. If I knew who sara was I would give her all the credit. I just wanted to share something that moved me because I’ve been struggling with all the negativity in the world.,t3_ho4otc
970,fxgmr5c,t1_fxgf73e,Fuck.... that got me,t3_ho4otc
971,fxgh4nr,t1_fxgfrrh,I am not Sara and do not want to take any credit!  I saw this earlier today and it made me cry (in a happy way). I wanted to share because we all need more of this.,t3_ho4otc
972,fxgpygw,t1_fxgpwo0,"Old people say passed away. They don't say die, the connotation is too much.",t3_ho4otc
973,fxgu1c5,t1_fxgt6lx,"I am not Sara, but she sounds like a wonderful human. If she’s a redditor (or if anyone on here knows her) I hope she sees this so she can get the credit she deserves!",t3_ho4otc
974,fxh15ja,t1_fxgz5qp,"As I have said on multiple comments, I am not Sara. I shared this post because it made me smile/cry this morning and I thought others might appreciate it too. If Sara is a redditor or any redditors know Sara, I would love to give credit.",t3_ho4otc
975,fxheu6k,t1_fxhe0ks,"I am not Sara, but I’m happy to know people like her exist!",t3_ho4otc
976,fxhmy87,t1_fxhme0l,"The intruder in your kitchen, bruh. Grabba fun and call the cops! Good luck!",t3_ho4otc
