,comment_id,comment_parent_id,comment_body,comment_link_id
0,fxfgqrf,t3_ho4otc,"How nice! People are always so quick to Tell a person or business the negative experience they had, but leave out the positive when that could really change someone's day or come at a time when they've been questioning themselves or feeling down.",t3_ho4otc
1,fxfhghz,t3_ho4otc,"We often don’t notice the impact we have on one another in the moment, what a beautiful letter",t3_ho4otc
2,fxflh0u,t3_ho4otc,That’s so sweet!! Almost made me cry. What a nice gesture of him to do! I hope it lifted up not just the day for you but the whole year ;),t3_ho4otc
3,fxfl4n5,t3_ho4otc,"excuse me this is r/mademesmile,  not r/mademetearupintheuber",t3_ho4otc
4,fxfwmfi,t3_ho4otc,"I was at an art festival and the man next to me had his wife with Alzheimer’s with him. He made sure to tell me beforehand and I told him if he needed any help I would be there, my sales be damned. I had a grandfather with Alzheimer’s. I would sit with her while he went to get water since it was so hot. She’d repeatedly ask where he was and I would repeat that he went to get water etc. Other vendors commented on my patience.  I told them it isn’t hard. She isn’t annoying. She literally can’t remember she already asked. It was super hot that weekend so I would buy them those orange pushpops and we would eat together. She was so happy and so excited. He thanked us at the end of the event. Sadly the next year I learned he had passed away but his son had taken over and was with his mom. We didn’t get the chance to talk and I didn’t want to stress her out by asking if she remembered us. It takes nothing to be kind.",t3_ho4otc
5,fxfmogz,t3_ho4otc,"Why did the sentence ""She felt so pretty"" just make me cry like a baby?",t3_ho4otc
6,fxfwhzg,t3_ho4otc,"When i was in cosmetology school, q woman came in for just a smille manicure. I got her ticket and shortly after I started, she was crying. I stopped for a moment and asked her if she was okay, she said this was the first time she's gotten a manicure in 8 months and the first since her daughter passed from cancer. She talked about her daughter, her love for animals, her favorite colors, and how they would have a spa day every month until she got sick. After I was done and walked her back to the front, she bought a few things from me and then asked if she could hug me. I let her and she just held me and squeezed for a few minutes and then thanked me. 

One of my teachers seen and asked if i knew her, I told her no, and explained what happened, she also hughed me and told me that I probably made her so happy. She came back in a week later and gave me a $10 tip from the week before and a sunflower from her daughters funeral because I mentioned how I love sunflowers and that was also her daughters favorite. 

This profession can suck, but it can be very rewarding. Ive had a few stories similar but this one really stuck with me and 2 years later, I still think about her from time to time.",t3_ho4otc
7,fxfkeja,t3_ho4otc,"Ok, I’m crying, that was beautiful",t3_ho4otc
8,fxfmxzy,t3_ho4otc,Crying on the toilet again,t3_ho4otc
9,fxfzavx,t3_ho4otc,"Am a hairdresser. One of my seasoned co-workers told me a story when I was first starting out about how when she was still kinda new, she had a normal day of clients, had a new lady come in for the first time to get her hair cut and styled. 
She said the appointment was real normal, just basic questions about herself and casual nice small talk and getting to know each other. The lady left and didn’t book another appointment. 
She got an email about a week later from the lady telling my co-worker that she probably didn’t realize the impact that she had on people and how just being nice could change everything. The woman had come to get her hair done because she was going to kill herself that night and didn’t want her family to have to worry about getting her made up for a funeral. 
She felt entirely different after that appointment and made sure to tell my coworker that she was the reason she decided not to go through with killing herself that night. 
Story has always stuck with me. Kindness goes a hell of a long way.",t3_ho4otc
10,fxfnmv6,t3_ho4otc,I'm a hairstylist and now I'm crying. I'm sure recieving this letter is one of the highlights of that stylist's career.,t3_ho4otc
11,fxfmz9r,t3_ho4otc,That must have made you feel incredible. Good for you!,t3_ho4otc
12,fxfwff4,t3_ho4otc,"I used to work in a Ski resort working with children. I was mainly looking after groups during lessons and at meals, but I once spent a week 1v1 teaching a child with learning difficulties and autism to snowplow, despite it not really being my job. By the end of the week, and after a lot of effort on both our parts, he had got the hang of it and was zooming around. A month later my boss gets an email from the family explaining that they always thought it was impossible he would ever be able to ski, as he could barely stand on skis on previous trips.

It was very heartfelt message and it showed me what a difference one person could make. It honestly changed the course I wanted to head in life. Don't underestimate these messages, they can only make the world a better place.",t3_ho4otc
13,fxfmq6n,t3_ho4otc,"I would treasure this message for the rest of my life, how beautiful.",t3_ho4otc
14,fxg0lud,t3_ho4otc,"I am pregnant and everything makes me cry, but this made me cry.",t3_ho4otc
15,fxfl7sq,t3_ho4otc,What a beautiful letter.,t3_ho4otc
16,fxfw3oe,t3_ho4otc,"To the world, you are just another person..but to one person, you are the world..this is an excellent example of treating people well because it's the right thing to do.

I'm so happy this customer took time to thank you. Well done!",t3_ho4otc
17,fxfy4oh,t3_ho4otc,"This brought tears to my eyes and a smile to my face.

My mom passed away last year.  Her sister, her best friends and myself spend much time with her in her final days, but my mom had a whole list of people she wanted to say goodbye to. She wrote them all a personal, hand-written letter. One of the letters was for her hairdresser, whom she had become good friends with in the 10+ years she was her customer. I don't know what the letter said, because I respected mom's privacy and passed it on in a sealed envelop. But I imagine it was something like this.

It's the little things indeed. Thank you so much for sharing.",t3_ho4otc
18,fxflr6v,t3_ho4otc,Sara's Christmas haircut is still cutting onions to this day.,t3_ho4otc
19,fxfr4m9,t3_ho4otc,"I have a friend that's really touch deprived. When his motjer passed away, he's since loved getting his hair cut at salons because the shampoo process on those sinks always reminds him of how his mom used to wash his hair when he was young.",t3_ho4otc
20,fxfo79q,t3_ho4otc,"Damn, as the hairdresser I would be speechless reading this and seeing the impact something I deem so simple actually has on my customers.

Beautiful letter!",t3_ho4otc
21,fxfo7o8,t3_ho4otc,"What a beautiful letter. Sometimes, people don't realise the power of their actions.",t3_ho4otc
22,fxfkyea,t3_ho4otc,I read Sara as Santa at first and got really confused,t3_ho4otc
23,fxfq7s8,t3_ho4otc,"My mom has early dementia. Stories like this warm my heart, but scare the hell out of me too. I don’t know if I’m emotionally strong enough to watch her slowly, or as it seems lately, rapidly, decline mentally knowing there isn’t anything I can do stop it. 

Thanks for sharing this, OP.",t3_ho4otc
24,fxg1f55,t3_ho4otc,"Not a hair stylist but I work for a pizza place in a part of town that’s mostly older people, and I often get calls during the day from older people who really just want someone to talk to. Sometimes they don’t even order anything, and it was annoying when I first started but I enjoy it now, because I know that covid is isolating a lot of these people even more so than they were before and they sound so happy after we talk.",t3_ho4otc
25,fxfnklg,t3_ho4otc,Right in the feels,t3_ho4otc
26,fxg1i2j,t3_ho4otc,"Made me cry. My girlfriend is a stylist and my grandmother had dementia. Shortly before she passed my dad asked if my she could cut my grandmas hair. We didn’t make it over there to get it done in time unfortunately before she passed away. I don’t remember why we didn’t make it there, it was all during the beginning of the COVID quarantine so that was definitely a factor. 

RIP grandma, love you!",t3_ho4otc
27,fxfldwy,t3_ho4otc,I wish they would stop chopping onions in here...,t3_ho4otc
28,fxfqh09,t3_ho4otc,Wait am I on r/MadeMeCry ?,t3_ho4otc
29,fxfo3eh,t3_ho4otc,That is so lovely,t3_ho4otc
30,fxfokt0,t3_ho4otc,We do not realise the impact we have on others sometimes. Just remember to be kind to each other because you never know when you will be the Sara.,t3_ho4otc
31,fxfoni9,t3_ho4otc,Damn...that one got me.,t3_ho4otc
32,fxfp8sw,t3_ho4otc,It's good to know that people like him still exist out there in times like these.,t3_ho4otc
33,fxfq4m8,t3_ho4otc,"All people deserve to be valued and treated with dignity. Thank you for giving this person some sense of worth and joy! You, my friend, were able to see the person in front of you and not a “job” to do— what a beautiful human gesture!",t3_ho4otc
34,fxfrqna,t3_ho4otc,I’m a little verklempt.,t3_ho4otc
35,fxfrwzw,t3_ho4otc,"The relationship that some women have with a nice hair cut makes me jealous. I was recently in the hospital for a couple days and my roommate was an older woman and during the my time she got a trim and it completely changed her mood. I was so happy for her and secretly wishing that I had a simple thing that just made me feel better like that haircut did for her.

Good for this stylist and good for her customers!",t3_ho4otc
36,fxg0lwa,t3_ho4otc,We all have the power to lift people up. All of us. What an awesome thing!,t3_ho4otc
37,fxg195k,t3_ho4otc,Anyone else thought there was something wrong with their phone screen?,t3_ho4otc
38,fxgk6w2,t3_ho4otc,Such a good reminder about how we should impact others in our daily lives.,t3_ho4otc
39,fxgoko6,t3_ho4otc,"I’m not crying, you are! 😭",t3_ho4otc
40,fxfm4c1,t3_ho4otc,MadeMeCry,t3_ho4otc
41,fxfn3mh,t3_ho4otc,"This made me tear up a little bit. I'm so happy that not only was Sara able to make that woman's day, but that that customer then took notice of how happy their wife was and took the time to write a letter for Sara to tell her. Were I Sara, I'd frame that letter. 

Sometimes it's the little things, and sometimes it's important to point out the little things too.",t3_ho4otc
42,fxfoz74,t3_ho4otc,😭,t3_ho4otc
43,fxfpn5i,t3_ho4otc,Bittersweet but beautiful!,t3_ho4otc
44,fxftqte,t3_ho4otc,My grandfather started developing Alzheimer’s/Dementia shortly before he passed. It was really hard to see him losing his memory and forgetting things that had once made him so happy. I really hope that he was able to find happiness and joy like that before he passed.,t3_ho4otc
45,fxfv374,t3_ho4otc,"This reminds me of my mom. She loved having her hair done, and they did it in the nursing home while she was in hospice a few weeks before she passed. It was the last time I saw her smile.",t3_ho4otc
46,fxfvcr0,t3_ho4otc,And now I’m crying!! I live with a dementia patient and I know it’s always the little things. My mother in law is now a shell of what she used to be but I know that she’s still in there.  Doing special treats like getting a haircut means the world to her.  I’m happy I got to see this today.,t3_ho4otc
47,fxfx2o9,t3_ho4otc,Thank you for sharing this.,t3_ho4otc
48,fxfxuqi,t3_ho4otc,"I’m not crying, you’re crying!",t3_ho4otc
49,fxfy4yq,t3_ho4otc,Did anyone else misread the intro as “Dear Santa”?,t3_ho4otc
50,fxfy7ub,t3_ho4otc,Yep.  I'm crying.,t3_ho4otc
51,fxfzk47,t3_ho4otc,"Good lord. I thought this was r/MadeMeSmile, not r/holyshitimabouttocrymyeyesout. Still with a 98 year old grandpa with dementia, it makes me beyond happy to know people like you exist.",t3_ho4otc
52,fxg0e69,t3_ho4otc,"I'm not crying , you're crying",t3_ho4otc
53,fxg0fmd,t3_ho4otc,Not trying to cry at work today.,t3_ho4otc
54,fxg0mn8,t3_ho4otc,This is why I’m on reddit!,t3_ho4otc
55,fxg0oco,t3_ho4otc,😭,t3_ho4otc
56,fxg1s2m,t3_ho4otc,"This made me tingle when I read it! People can be good folks! We all affect the world around us, even if we don’t know it! Be magical every day, it makes a difference.",t3_ho4otc
57,fxg1ued,t3_ho4otc,That's beautiful! And now I'm tearing up in the office bathroom...,t3_ho4otc
58,fxg1v1s,t3_ho4otc,I needed this dose of goodness today!,t3_ho4otc
59,fxg1v32,t3_ho4otc,Fuck you this didn’t make me smile I’m CRYING,t3_ho4otc
60,fxg214k,t3_ho4otc,"I’m not crying, YOU’RE crying!",t3_ho4otc
61,fxg21b0,t3_ho4otc,"Who’s cutting those dang onions again!!!  

I cantysee for all the water in them!!!",t3_ho4otc
62,fxg21hd,t3_ho4otc,"That makes me want to cry, some people are so good in this world.",t3_ho4otc
63,fxg2a4h,t3_ho4otc,"I'm not crying there's just hair in my eyes.

I love when people take the time to write in a positive manner.  I try really hard to do that.  I don't always make it happen, but it's so great to be part of a circle of kindness.  Someone is kind to you, you express appreciation, it helps give them the motivation to continue being kind, which maybe inspires someone else to be kind.",t3_ho4otc
64,fxg2bx5,t3_ho4otc,Who's crying?! I'm not crying!,t3_ho4otc
65,fxg2fcl,t3_ho4otc,Wow!! Such a heart warming act of kindness!,t3_ho4otc
66,fxg34tk,t3_ho4otc,Is there a made me tear up subreddit got dang.,t3_ho4otc
67,fxg3tmc,t3_ho4otc, My sincerest condolences. On our very first anniversary my wife and I vowed to make it to our fiftieth.   We missed by a year and a half. I miss her so.,t3_ho4otc
68,fxg3zzl,t3_ho4otc,Excuse me while I go cry forever,t3_ho4otc
69,fxg50nb,t3_ho4otc,"Awww mannnnn..... come on!!! Can the onion ninjas just take a day off, please?",t3_ho4otc
70,fxgaoh7,t3_ho4otc,Jesus Christ why are my eyes leaking so much!,t3_ho4otc
71,fxgaqo1,t3_ho4otc,"I'm not crying, YOU'RE CRYING!!",t3_ho4otc
72,fxgd2gp,t3_ho4otc,frame it up and put it in your saloon,t3_ho4otc
73,fxgd4uf,t3_ho4otc,Oh geez. I'm tearing up over here.,t3_ho4otc
74,fxgd6x6,t3_ho4otc,Who the fuck is cutting onions,t3_ho4otc
75,fxgd9up,t3_ho4otc,I’m crying tears of love.,t3_ho4otc
76,fxgdk02,t3_ho4otc,This post taught me that it seems easier to complain rather than complimenting when we SHOULD be doing the opposite. Thank you for sharing!,t3_ho4otc
77,fxgfan3,t3_ho4otc,"This is very nice and all.  But OP, where did you find it?  I know you said you're not Sara.  That's fine.  But is there any indication that this is real?",t3_ho4otc
78,fxgiylm,t3_ho4otc,As a hairstylist myself this made me tear up! Moments like these are what makes our profession so worth it,t3_ho4otc
79,fxgj8tv,t3_ho4otc,"Thanks for sharing your magic, Sara.",t3_ho4otc
80,fxgj8w5,t3_ho4otc,Damn that made me tear up,t3_ho4otc
81,fxgmq07,t3_ho4otc,"OP isn't the barber, look at their post history.

That is assuming that the letter itself wasn't faked",t3_ho4otc
82,fxgobcb,t3_ho4otc,I read the top as ‘dear santa’ so I was really really confused,t3_ho4otc
83,fxgoyh8,t3_ho4otc,"Goddammit, Sara!  You made me tear up!",t3_ho4otc
84,fxgpcnb,t3_ho4otc,😭😭😭❤️❤️❤️,t3_ho4otc
85,fxgphec,t3_ho4otc,"I'm trying to work, stop making me cry",t3_ho4otc
86,fxgqe8y,t3_ho4otc,"Isn’t it strange how a little thing can change a person life? I’m crying, best thing of the day",t3_ho4otc
87,fxgr7p1,t3_ho4otc,Damn allergies making my eyes water 💗,t3_ho4otc
88,fxgrfaa,t3_ho4otc,Sobbing. This is lovely,t3_ho4otc
89,fxgseed,t3_ho4otc,Why are my eyes sweating,t3_ho4otc
90,fxgu36p,t3_ho4otc,"My manager always uses a quote from Maga Angelou: People will forget what you said, people will forget what you did, but people will never forget how you made them feel.",t3_ho4otc
91,fxgvvr5,t3_ho4otc,I’ve scrolled passed this thing like 8 times today and every time I think it says “Dear Santa”.,t3_ho4otc
92,fxh551a,t3_ho4otc,im not crying.. you are crying!,t3_ho4otc
93,fxhdqgb,t3_ho4otc, My parents didn't sign a permission slip for this feels trip,t3_ho4otc
94,fxhrnfh,t3_ho4otc,"The hairdresser was wonderful as are you in letting her know of your wife’s experience. Your wife was a lucky woman to have had you as a husband, and she must have been very special as well. You must have many wonderful memories.",t3_ho4otc
95,fxhvuby,t3_ho4otc,I'm not crying... my eyes are just sweating,t3_ho4otc
96,fxhxi1c,t3_ho4otc,Fuck this made me cry.,t3_ho4otc
97,fxhy9t8,t3_ho4otc,"This is so beautiful. The small things in ones life that we don’t pay much mind to, may be one of the most memorable moments for others ❤️",t3_ho4otc
98,fxhzwc0,t3_ho4otc,Holy shit. So moving and we'll written. Sorry if this was your wife OP.,t3_ho4otc
99,fxi2a4w,t3_ho4otc,Why am I crying!!!!!????,t3_ho4otc
100,fxi3bmh,t3_ho4otc,"Such a beautiful letter. 
I’ve been there working at a grocery store and one guy came in twice a week for over a year for just mini watermelons (silly I know) and I always picked them for him. I’d even cut them in half to make sure they were good since he wanted them year round.

Suddenly I didn’t see him for two months until one evening right before closing he showed up, cracked a quick joke and told me something that made me cry in the back room and I still do when I think about it to this day.

His wife had been battling stage 4 breast cancer for almost two years and said she enjoyed every watermelon he ever brought home and it was one of the few things she was actually able to eat.
Knowing the touch you can have on even just a single person on a normal work day is so powerful.
It really is the little things.
Mad props to this kick-ass hairdresser.",t3_ho4otc
101,fxiggvu,t3_ho4otc,This is just beautiful. My eyes are raining,t3_ho4otc
102,fye6pej,t3_ho4otc,"I'm not crying, your are.   Just goes to show how something so small can mean so much.  A little kindness can change someones day or even their life.",t3_ho4otc
103,fzm1atl,t3_ho4otc,"This is such an important post, and I agree with so much of what has been said before- we are quick to criticize and slow to compliment. We might all be that little more happier if we complimented more.",t3_ho4otc
104,g0ecy3x,t3_ho4otc,Omgawdh. I am in senior care and am putting ofd hair school to stay with my client who I  care for.  She is 102 and when I told her family I was going to hair school in the fall they panicked.  I watched agency after agency come in to interview and repeatedly tell this family they do not offer the level of care that I do as a private care giver. I could not leave her. I know my work means something to someone and I hope when I do become a stylist I can have moments like this!! This made my day. Thank you for sharing this! I cannot wait to make people feel pretty,t3_ho4otc
105,fxfxlgo,t3_ho4otc,"Oh cool another fake letter for a karma grab!

Edit: I do really love the idea behind it though. But if you look at their account it really seems like a grab.",t3_ho4otc
106,fxfma2n,t3_ho4otc,I'm not crying you're crying,t3_ho4otc
107,fxfo8u1,t3_ho4otc,Little gestures like this mean everything. I love it. It brought tears to my eyes.,t3_ho4otc
108,fxfn75t,t3_ho4otc,I'm smile-crying.,t3_ho4otc
109,fxfpeqy,t3_ho4otc,\*THIS\* is what Life and \*Living\* is all about.  Beautiful.,t3_ho4otc
110,fxfpib9,t3_ho4otc,Omg <3,t3_ho4otc
111,fxfq3gj,t3_ho4otc,We need more of this. 👏🏼🙌🏼,t3_ho4otc
112,fxfq4fb,t3_ho4otc,So damn sweet.,t3_ho4otc
113,fxfq5h1,t3_ho4otc,So many little things have the potential to make someones day.,t3_ho4otc
114,fxfqodf,t3_ho4otc,That's sooo cute I can't ToT,t3_ho4otc
115,fxfqp29,t3_ho4otc,"So many people in so many professions help people in ways they will never know. Imagine if we all knew every time we made a large impact on someone, directly or indirectly. We would probably feel much better about ourselves. Especially people in low wage professions that don’t feel very important.",t3_ho4otc
116,fxfqq35,t3_ho4otc,"Watching the news or twitter you could be forgiven for thinking the world is a hateful place

But the vast majority are good people leading their lives, doing great things while not looking for credit and flying under the radar. The unsung hero segment of Sports Personality of the Year always brings that home. 

Always try and remember that",t3_ho4otc
117,fxfrged,t3_ho4otc,"This should be at the top of Reddit’s front page. 
You did an amazing job. So much so, that it left a lasting impression on her husband’s mind/heart and he has relived that precious day so many times he simply had to let you know. 

What an honor to have played a part in another person’s life to the point that they take the time to write you and lift you up in a time like this. 

You’re remembered. ❤️",t3_ho4otc
118,fxfrnpk,t3_ho4otc,Goosebumps. Thanks for sharing!,t3_ho4otc
119,fxfryig,t3_ho4otc,Lovely,t3_ho4otc
120,fxfsaea,t3_ho4otc,My mother in law suffers from dementia. She’s fading away so quickly. I’m sitting here crying. Thank you Sara.,t3_ho4otc
121,fxfspub,t3_ho4otc,RIP,t3_ho4otc
122,fxfswwf,t3_ho4otc,My eyes are sweating,t3_ho4otc
123,fxft157,t3_ho4otc,Omg 😭,t3_ho4otc
124,fxft64e,t3_ho4otc,As a hairstylist In training I hope I can do this for others as I graduate and and start my jobs,t3_ho4otc
125,fxft7dd,t3_ho4otc,"Man, in these lonely times where things seem hopeless, this really hit me hard. I wish I could have seen her face after she looked in the mirror.",t3_ho4otc
126,fxftcvu,t3_ho4otc,"No matter what we do, we all can make someone's experience a great unforgettable moment of their lives with kindness. That's all I Learned from the comments. Love you guys!!",t3_ho4otc
127,fxftopp,t3_ho4otc,"*Random fish from Spongebob* 
""MY EEYYEESS!!!""",t3_ho4otc
128,fxftwd1,t3_ho4otc,I read that as Santa at first,t3_ho4otc
129,fxfu65d,t3_ho4otc,Ow my heart.,t3_ho4otc
130,fxfu72g,t3_ho4otc,That was not awkward at all,t3_ho4otc
131,fxfu892,t3_ho4otc,Beautiful,t3_ho4otc
132,fxfuc76,t3_ho4otc,Having my haircut is probably the single biggest thing I do for my confidence in a month. Always walk out with head held high and chest puffed out like bantam cockerel.,t3_ho4otc
133,fxfuefe,t3_ho4otc,"This is so beautiful. The event, the reaction of the client and the lovely act of writing a note. It really is the little things.",t3_ho4otc
134,fxfueg1,t3_ho4otc,I sent a similar letter like this to my barber but it was just to thank him for cutting my hair in silence and not making me talk the whole time,t3_ho4otc
135,fxful3r,t3_ho4otc,And posts like yours OP is the reason I and many others like me get out of bed every morning and hope today will be better and brighter than yesterday.,t3_ho4otc
136,fxfupea,t3_ho4otc,So incredibly sweet.,t3_ho4otc
137,fxfux9x,t3_ho4otc,That's just beautiful.,t3_ho4otc
138,fxfvcu9,t3_ho4otc,"i first read this as ""Dear Santa"" and was imagining a Santa costumed hairdresser thinking it was kinda different but sure, why not lol",t3_ho4otc
139,fxfvg00,t3_ho4otc,"Hey, June 27 is my Bday",t3_ho4otc
140,fxfvksl,t3_ho4otc,"Things like this is one of the reasons I genuinely enjoyed retail.

One time I had a mom call the store and thanked me for ""saving her son's birthday"". I remember that call more than any negative experience I had.",t3_ho4otc
141,fxfvqqc,t3_ho4otc,"WOW!  How sweet is that?!

It's like I've always heard, ""Be kind to everyone you meet because you never know what they're going through.""",t3_ho4otc
142,fxfw0k5,t3_ho4otc,"its the little things that really matter

[https://www.youtube.com/watch?v=P7Hr6fl7zoI](https://www.youtube.com/watch?v=P7Hr6fl7zoI)",t3_ho4otc
143,fxfw1fd,t3_ho4otc,"Things like this truly make a difference for those of us in the service industry.  For me at least.  Being in kitchens can be unforgiving with the heat, long hours, psychological abuse, no down time.  Seeing that you're making someone happy, even for just a meal, can make that long day worth it.",t3_ho4otc
144,fxfw57p,t3_ho4otc,Read Sara as Santa and didn’t realize but is still very nice,t3_ho4otc
145,fxfw9uc,t3_ho4otc,That’s beautiful 😭,t3_ho4otc
146,fxfwbvs,t3_ho4otc,Now I am crying :(,t3_ho4otc
147,fxfwcoy,t3_ho4otc,These types of marriages are the gold standard I hold my marriage to. I hope that my wife and I grow old and gray together so we can both sit in front of each other during a haircut to remind the other of the life we had...,t3_ho4otc
148,fxfwfn5,t3_ho4otc,"I'm not crying, you're crying.",t3_ho4otc
149,fxfwjmm,t3_ho4otc,"Unless they've done something really unacceptably horrible I don't even bother with bad reviews now.  It's pointless, most businesses have bad days and reading a 15 line rant about how my chips were soggy isn't going to stop other people going there (nor should it).  I just move on and decide whether I'll use the business again personally.

Positive reviews make me feel better, and I've never left one where I haven't had a nice reply from the business.  It means a lot to them, especially small businesses.",t3_ho4otc
150,fxfwjvm,t3_ho4otc,"Welp, I'm crying.",t3_ho4otc
151,fxfwkee,t3_ho4otc,I’m not crying you’re crying,t3_ho4otc
152,fxfwl5s,t3_ho4otc,That punched me right in the chest,t3_ho4otc
153,fxfwljg,t3_ho4otc,I'm not *sniff* crying 😢,t3_ho4otc
154,fxfwqpd,t3_ho4otc,Im crying oh my god. This is so sweet 😭❤️ Rest In Peace you beautiful lady,t3_ho4otc
155,fxfws43,t3_ho4otc,"And my heart just broke. My mom had dementia. My dad found a stylist who was so kind to my mom, and my mom could be a real handful (she could get paranoid and belligerent). My dad gave her a $50.00 tip every time.",t3_ho4otc
156,fxfwthq,t3_ho4otc,"IM NOT CRYING, YOU'RE CRYING!! 
 
 This is seriously so beautiful.",t3_ho4otc
