,comment_id,comment_parent_id,comment_body,comment_link_id
597,fxgvfl3,t3_ho4otc,I am not crying at all😭😭,t3_ho4otc
598,fxgvm9t,t3_ho4otc,❤️,t3_ho4otc
599,fxgvms9,t3_ho4otc,❤️,t3_ho4otc
600,fxgw97j,t3_ho4otc,This did not make me smile.,t3_ho4otc
601,fxgwc2p,t3_ho4otc,Ugh if you don’t shed a tear you are not human. Bless the hairdresser,t3_ho4otc
602,fxgwkj4,t3_ho4otc,Sometimes just doing your job means the world to someone else.,t3_ho4otc
603,fxgwlft,t3_ho4otc,Amazing!,t3_ho4otc
604,fxgwp6b,t3_ho4otc,I live my barber she is the greatest !,t3_ho4otc
605,fxgwqmo,t3_ho4otc,As a hairstylist myself this made my heart smile ❤️,t3_ho4otc
606,fxgwquf,t3_ho4otc,"This makes my heart hurt. I haven't been able to see my mom in almost a year and I can picture her now, dropping the groceries off in the kitchen and smiling to herself after getting her haircut. She older now and her hair has long since turned grey but I can see the girl inside of her in those moments. 

Probably the only thing I hate about quarantine is the fact that I can't see my family. Time just feels like it's slipping away",t3_ho4otc
607,fxgwwph,t3_ho4otc,It’s hard reading with tears in your eyes,t3_ho4otc
608,fxgwx6d,t3_ho4otc,Who is cutting onions?,t3_ho4otc
609,fxgwy5d,t3_ho4otc,Fuck that man this r/mademecry ! Wow how beautiful,t3_ho4otc
610,fxgx6d3,t3_ho4otc,This proves doing something good can make someone so happy no matter what,t3_ho4otc
611,fxgxap3,t3_ho4otc,Why do you have to make me cry when I'm at work?,t3_ho4otc
612,fxgxaph,t3_ho4otc,Who’s cutting the onions again,t3_ho4otc
613,fxgxays,t3_ho4otc,"More like ""mademecry"".  But in a good way.  His letter is so heartfelt and true - you never know what makes a big difference in someone's day, or life.",t3_ho4otc
614,fxgxdh1,t3_ho4otc,"Well shit, now I'm crying",t3_ho4otc
615,fxgxed5,t3_ho4otc,Damn did someone cut an onion or ...,t3_ho4otc
616,fxgxlm9,t3_ho4otc,Damn who left out the onions :'(,t3_ho4otc
617,fxgy6jm,t3_ho4otc,Now that I’m crying 😭,t3_ho4otc
618,fxgyasv,t3_ho4otc,Damn this hayfever... sniff.,t3_ho4otc
619,fxgytvk,t3_ho4otc,"Curl up, don't cry, cry a lot",t3_ho4otc
620,fxgyzyx,t3_ho4otc,i’m not crying you are,t3_ho4otc
621,fxgz3pv,t3_ho4otc,"Its enough to make a grown man cry
And thats ok",t3_ho4otc
622,fxgz5qp,t3_ho4otc,Why would a hairdresser be browsing r/accounting? Why are you doing this for fake Internet points?,t3_ho4otc
623,fxgzil0,t3_ho4otc,Wow. I had a really rough day. This post is beautiful. Thank you. It's the little things that matter. Thank you.,t3_ho4otc
624,fxgzu7e,t3_ho4otc,One of the most eloquently simple but beautiful things I've ever read on all my years on this site...thank you for sharing this warmed my heart,t3_ho4otc
625,fxh07b8,t3_ho4otc,Sniff................Dang....Thank you for sharing.....,t3_ho4otc
626,fxh0eod,t3_ho4otc,Smiling and crying. So wonderfully thoughtful for the person to send that letter too.,t3_ho4otc
627,fxh0gcr,t3_ho4otc,"This is the happiest saddest thing I’ve ever seen, this is so wholesome!",t3_ho4otc
628,fxh0len,t3_ho4otc,"I'm not crying at 7am, you are",t3_ho4otc
629,fxh0wpk,t3_ho4otc,Fuck.,t3_ho4otc
630,fxh10ym,t3_ho4otc,*wipes away tears* that's enough reddit for today,t3_ho4otc
631,fxh18xc,t3_ho4otc,I thought that said Dear Santa...,t3_ho4otc
632,fxh1eqq,t3_ho4otc,Insert *everybody liked that*,t3_ho4otc
633,fxh1na5,t3_ho4otc,"This is the reason why I do what I do. It is so rewarding to see the look on someone’s face after giving them a good haircut and knowing they feel like themselves again, and knowing I have the power to give someone that feeling is indescribable. Not only that but getting to know someone by doing their hair, being the person they feel like they can talk to, being there for them after they have children, when they get married, when they experience loss. Being the person that lifts them up by just doing what feels like a routine, simple thing, but knowing it’ll make a huge difference to them. Sometimes I feel like people take hairstylists for granted but then I get clients like these and it reminds me of why I got into it in the first place. I can’t imagine doing anything else.

EDIT: fixed a couple typos",t3_ho4otc
634,fxh1qb8,t3_ho4otc,I'm no- yes I am. I'm crying y'all.,t3_ho4otc
635,fxh1rpl,t3_ho4otc,"I’m not crying , you are.",t3_ho4otc
636,fxh246y,t3_ho4otc,Thank you for wrecking me emotionally twice (came back for a re-read),t3_ho4otc
637,fxh24cn,t3_ho4otc,I really needed to see that,t3_ho4otc
638,fxh2fva,t3_ho4otc,So touching. 😭,t3_ho4otc
639,fxh2ll1,t3_ho4otc,"This is wonderful. Thanks to the person who wrote the letter. And thanks to the person who gave the haircut. It feels really good to show appreciation. I am grateful for this interaction. Now I want to give everyone a hug.

*Hug*",t3_ho4otc
640,fxh2n4n,t3_ho4otc,Keep this forever and look at it every day ♥️,t3_ho4otc
641,fxh2owy,t3_ho4otc,I love my girlfriend,t3_ho4otc
642,fxh30ph,t3_ho4otc,Frame that. So beautiful!,t3_ho4otc
643,fxh39s6,t3_ho4otc,What the fuck I’m sad now,t3_ho4otc
644,fxh39zk,t3_ho4otc,Well done. A wonderful tribute to compassion and the power of love.,t3_ho4otc
645,fxh3pcg,t3_ho4otc,This makes me feel so happy to be a hairdresser. I hope I give that type of service that makes people forget the bad stuff In their lives,t3_ho4otc
646,fxh3vz7,t3_ho4otc,God I wish I had a haircut like that. Instead I'm usually tempted to ask for a refund or at least not give them a tip and a nasty look. I do go to the fish market for my haircut though and it's not what they do I've just been really pushy with them. They've come to expect it now fair play and are getting a better and even let me sit on the counter.,t3_ho4otc
647,fxh49ye,t3_ho4otc,"I’m not crying, you’re crying!",t3_ho4otc
648,fxh4gil,t3_ho4otc,Who TF is cutting onions. STOP!!!,t3_ho4otc
649,fxh4iro,t3_ho4otc,Holy shit,t3_ho4otc
650,fxh4j5w,t3_ho4otc,More like r/mademecry,t3_ho4otc
651,fxh4lbo,t3_ho4otc,"I love this story. I serve and bartend for my job right now. Recently I had a solo lady sit in my section. I was just doing my job, recommending meals, refilling her tea a few times, offering dessert. At the end of the meal, she came up to me and gave me a $20 cash tip on her $22 bill. She said “I’ve been having a rough time lately and I just want you to know it meant a lot to me that you took such great care of me today, thank you for making me feel so welcomed.” Like this story; people like to be taken care of.",t3_ho4otc
652,fxh4lrs,t3_ho4otc,Read it as dear santa and nonetheless I was very confused for a good couple minutes,t3_ho4otc
653,fxh4q49,t3_ho4otc,More like r/mademecry,t3_ho4otc
654,fxh4xz7,t3_ho4otc,"Well, I didn't plan on crying before dinner, but now I'll be sure to tell my wife I love her even more tonight. Thanks for the reminder!",t3_ho4otc
655,fxh5b0s,t3_ho4otc,Damn onions!,t3_ho4otc
656,fxh5bwo,t3_ho4otc,Screen too blurry. Can't read. This was nice lol,t3_ho4otc
657,fxh5fal,t3_ho4otc,Straight.in.the.feels.,t3_ho4otc
658,fxh5jjy,t3_ho4otc,Thank you for sharing this.,t3_ho4otc
659,fxh5kk0,t3_ho4otc,This is so beautiful. Damn all the feels,t3_ho4otc
660,fxh5mus,t3_ho4otc,That's enough to make a grown woman cry... and that's ok !,t3_ho4otc
661,fxh5skd,t3_ho4otc,"Read the first line as “Dear Santa,” and was very confused for a while.",t3_ho4otc
662,fxh5skg,t3_ho4otc,Tears! This hits home as my grandmother is suffering from dementia right now. ❤️,t3_ho4otc
663,fxh6mkj,t3_ho4otc,"As the eldest child of a woman with early onset Alzheimer's, this has made me teary.",t3_ho4otc
664,fxh6nl9,t3_ho4otc,That’s really nice but that’s quite a bit of pressure to put on the barber.,t3_ho4otc
665,fxh7mf6,t3_ho4otc,Nope I'm not crying rn. These are just eye sweat.. whaaaaaa,t3_ho4otc
666,fxh7vns,t3_ho4otc,r/mademesoblikeabitch,t3_ho4otc
667,fxh87at,t3_ho4otc,This is a repost of the top post all time of this subreddit....,t3_ho4otc
668,fxh8ae7,t3_ho4otc,I thought this was /r/MadeMeSmile and not /r/Crylikeabitch,t3_ho4otc
669,fxh8agr,t3_ho4otc,Is it raining? I felt a drop on my cheeks.,t3_ho4otc
670,fxh8g7o,t3_ho4otc,OP should have warned that this post was guarded by onion cutting ninjas .,t3_ho4otc
671,fxh8kny,t3_ho4otc,Thanks reddit for making me cry,t3_ho4otc
672,fxh8vps,t3_ho4otc,Cries,t3_ho4otc
673,fxh8xbp,t3_ho4otc,I’m not crying. You’re crying!,t3_ho4otc
674,fxh9t5r,t3_ho4otc,More like made me cry.,t3_ho4otc
675,fxha8sk,t3_ho4otc,That was a melancholy smile.,t3_ho4otc
676,fxhaems,t3_ho4otc,Some people can be so kind. I would cry if I received something like this and I’m a tough guy.,t3_ho4otc
677,fxhat6h,t3_ho4otc,That is beautiful.,t3_ho4otc
678,fxhaxam,t3_ho4otc,"Luckily this'll get buried, because it's a bit of a trade secret - but when I worked as a Game Master, we could gift something to a customer as a surprise. There were a LOT of different reasons why, but I remember finding an excuse for one customer. His house had burned down, but he was really nice and we joked around even though this tragic thing happened to him. I then gifted him a Cinder Kitten. He laughed.",t3_ho4otc
679,fxhb1ha,t3_ho4otc,I'm not crying you're crying,t3_ho4otc
680,fxhb91a,t3_ho4otc,Nothing means as much to me as when people are kind to people I love. It will charm me every time.,t3_ho4otc
681,fxhb9lx,t3_ho4otc,I like to claim im a macho man but this right here made me shed a tear.,t3_ho4otc
682,fxhbj5v,t3_ho4otc,Well... I'm tearing up.,t3_ho4otc
683,fxhbmok,t3_ho4otc,Straight out of Violet Evergarden.,t3_ho4otc
684,fxhbpfz,t3_ho4otc,"Now, that woman would remember the couple all her life and be grateful for what she could do! God bless people like them.",t3_ho4otc
685,fxhcf29,t3_ho4otc,"i worked for high- end mens salon and our clients were always very kind, patient and respectful. we rarely had conflict with clients - i honestly never had a client that was rude to me, being there 5 years. there were many moments where clients left me overwhelmed with tears after a nice gesture, generous tip, good review etc. but there was a doctor who was only in chicago for a year for his residency. every haircut was a joy. he would ask questions about my profession and compare it to his clients that he would get at his practice. he made me feel equal and not less of a person because of my profession. our last haircut, i will never forget...he told me “you change people lives and make people feel better, i’m so happy i met you”. i cried so hard after he left. it was funny because his first haircut with me was for his wedding, he loved it so much, he kept coming. good guy.",t3_ho4otc
686,fxhcjnf,t3_ho4otc,Ok I haven't literally started crying at a Reddit post in a long time.😭,t3_ho4otc
687,fxhd9gf,t3_ho4otc,It's the onions I swear...,t3_ho4otc
688,fxhdncu,t3_ho4otc,Id be on the floor in a ball crying if a guest gave me such a letter. How lovely,t3_ho4otc
689,fxhdpdj,t3_ho4otc,"First time visiting this sub, first post I saw and now I am in tears. 

Wrong sub name",t3_ho4otc
690,fxhe0ks,t3_ho4otc,That made me cry. What a blessing you became to them over and over that day. Thank you for being a good one.,t3_ho4otc
691,fxhe5a3,t3_ho4otc,This letter is making me cry,t3_ho4otc
692,fxhe8su,t3_ho4otc,Thank you for sharing! This is good stuff,t3_ho4otc
693,fxhekpy,t3_ho4otc,"That’s so amazingly beautiful, and thank you so much for injecting some humanity in my day. It’s heartwarming to hear this, when the news, and social media, and yes, reddit too, is full of so much inhumanity. You‘ve done good, and so deserve to spread that round. Keep it up.",t3_ho4otc
694,fxheout,t3_ho4otc,For some reason my brain read “Dear Santa”...the first half of the letter was a little confusing until I looked back at the top to realize my mistake,t3_ho4otc
695,fxhfkgj,t3_ho4otc,"I’m not crying, you’re crying!",t3_ho4otc
696,fxhfv22,t3_ho4otc,Damn onion cutting ninjas!,t3_ho4otc
697,fxhgak3,t3_ho4otc,"I'm not crying, you are!!! Fuggin' onions!",t3_ho4otc
698,fxhgp4t,t3_ho4otc,"I believe this line by sir Ian McKellen portraying Gandalf, helps to sum up this. 
""Saruman believes that it is only Great-Power can hold evil in check, but that is not what I have found. I have found that it is the small things.  Everyday deeds done by ordinary folk that keeps the darkness at Bay. Simple acts of kindness and love.""",t3_ho4otc
699,fxhgtah,t3_ho4otc,Wow...that was beautiful.,t3_ho4otc
700,fxhh62q,t3_ho4otc,I'm not crying you are crying.,t3_ho4otc
701,fxhifu8,t3_ho4otc,Beautiful. Amazing. Just what I needed to read today.,t3_ho4otc
702,fxhivfv,t3_ho4otc,This reminds me of my Mother. She had gone blind and was so depressed towards the end she didn't even want to take a bath let alone get a haircut. She was always so meticulous about her appearance she was vain but deservedly so. She was beautiful. It made me so sad to see her in such a state so I bathed her and took her to her beauty shop Violet and Olga's place she was a regular but hadn't been back in ages. They were so happy to see her and they talked the whole time. She lit up like she lost 20 years and could see again.  she couldn't but she felt human and she loved her haircut which actually looked great. They told me that I didn't have to bring her in anymore and that they would come to the house and keep her looking and feeling good. They were the best.,t3_ho4otc
703,fxhj65p,t3_ho4otc,Oh my heart ❤️,t3_ho4otc
704,fxhju7l,t3_ho4otc,I'm not crying you're crying.,t3_ho4otc
705,fxhk3va,t3_ho4otc,[deleted],t3_ho4otc
706,fxhltc3,t3_ho4otc,So wonderful. Makes me wanna believe in humans again.,t3_ho4otc
707,fxhm6qf,t3_ho4otc,"My mother suffered dementia. Her hairdresser (also mine) was one of the last people out of the immediate family, that mum “remembered.” She  (shout out to Deb) and the staff were so kind and patient. I will always appreciate it. And yep, this made me tear up, because I completely understood.",t3_ho4otc
708,fxhme0l,t3_ho4otc,Who the hells cutting onions?,t3_ho4otc
709,fxhn7qv,t3_ho4otc,I read that as “Dear Santa” and let me tell you that was a wild ride,t3_ho4otc
710,fxhnhwy,t3_ho4otc,"I’m not crying, you’re crying.",t3_ho4otc
711,fxhnkd8,t3_ho4otc,My grandmother has Alzheimer's disease. This just made me sob like a baby.,t3_ho4otc
712,fxhnpc3,t3_ho4otc,"Fuck man, now I'm blinking back tears in the fuckin locker room at the factory. Fuckin Reddit",t3_ho4otc
713,fxhp6qt,t3_ho4otc,"Feel so nice, I almost cry",t3_ho4otc
714,fxhqet9,t3_ho4otc,More like made me cry amirite??,t3_ho4otc
715,fxhrhrx,t3_ho4otc,This should be a short film ❤️❤️❤️❤️,t3_ho4otc
716,fxhrl5y,t3_ho4otc,Best thing I’ve ever seen on reddit,t3_ho4otc
717,fxhslsh,t3_ho4otc,"As a hairstylist too, this really hits close to home.  I love this part of the job.",t3_ho4otc
718,fxht6v3,t3_ho4otc,Ahhhhhhh i was looking for shit posts to be angered by but now im almost at a full cry damn u,t3_ho4otc
719,fxhu8p1,t3_ho4otc,Superb Sara!  Take that with you no matter where you go,t3_ho4otc
720,fxhubei,t3_ho4otc,#WOW,t3_ho4otc
721,fxhvjc9,t3_ho4otc,Omg I’m not crying (sniff sniff),t3_ho4otc
722,fxi19gh,t3_ho4otc,(606)2518480,t3_ho4otc
723,fxi29ad,t3_ho4otc,I mean it made me cry... but then I smiled.,t3_ho4otc
724,fxi3dch,t3_ho4otc,I did it again,t3_ho4otc
725,fxi3kmc,t3_ho4otc,I'm not crying! YOU'RE crying!,t3_ho4otc
726,fxi45ot,t3_ho4otc,"I call bullshit.

If it was real they would have left a name and signed it.

I never seen a letter written by anyone who would be under the applied age range & they not sign a letter properly or even give their own name.",t3_ho4otc
727,fxi4ixo,t3_ho4otc,"I used to work at a spa that had a “daymaker” approach. The concept was based on a hair dresser that had a profound experience like this happen. One of his usual clients called for styling but it wasn’t her usual day or service but the cosmetologist didn’t think much of it at the time. During the service he said he felt an overwhelming sense of needing to be present in the moment and talk with the girl whose hair he was working on. They had a normal conversation and she went on her way. A few days later he received a letter that said something along the lines of “I came to you to do my hair and you didn’t know that I was having a hard time. The way you treated me like a human and paid attention to me really made my day. I was coming to get my hair done because I was going home to kill myself and wanted to look okay when they found me. Thank you for taking the time to really talk to me that day.” From that day on, he changed all his business cards to say “Daymaker” instead of cosmetologist.",t3_ho4otc
728,fxi4qaw,t3_ho4otc,"Is there a r/suddenlyonions kinda subreddit, where you can post things that bring a happy tear to your eye?",t3_ho4otc
729,fxi5oy9,t3_ho4otc,This breaks my heart. I'm a veteran hairdresser and was told today I am not worth my prices and then I was later fired by that client when he found some one else to take him on. This gives me hope that there are still some grateful people out there.,t3_ho4otc
730,fxi6d76,t3_ho4otc,"Thanks, Sara!",t3_ho4otc
731,fxi86nh,t3_ho4otc,Wow I can’t believe the date was 2020 it’s the one positive thing I’ve seen associated with this number,t3_ho4otc
732,fxiajnt,t3_ho4otc,L,t3_ho4otc
733,fxiaza5,t3_ho4otc,Dude that last sentence hits hard.,t3_ho4otc
734,fxibteq,t3_ho4otc,"There are no Onion ninjas, nor is it raining in my room. I am crying and these are manly tears",t3_ho4otc
735,fxikonp,t3_ho4otc,This made me cry actually,t3_ho4otc
736,fxinukr,t3_ho4otc,"I wasn’t expecting this post to blow up the way it did. I want to make it very clear I am not Sara nor am I the author of this letter (which I’ve stated in the comments several times). If Sara is on here or anyone knows Sara I’d happily give credit. I just wanted to share a nice bit of humanity, and it has been awesome reading the mostly positive replies. There is so much goodness in the world we don’t get to see, and I think this letter is a reminder :)",t3_ho4otc
737,fxiti2j,t3_ho4otc,HOW DO I UPVOTE TWICE,t3_ho4otc
738,fxiur5g,t3_ho4otc,"This is one of the things you'll remember your whole life, and it's beautiful.",t3_ho4otc
739,fxiw6pt,t3_ho4otc,Made me smile?!?! Made me cry 😭 wow,t3_ho4otc
740,fxjce76,t3_ho4otc,"Hey, whoever you are, stop it with the onion cutting right now!",t3_ho4otc
741,fxjkpkx,t3_ho4otc,Wait but June 27 2020 hasn’t happened yet,t3_ho4otc
742,fxk5jhd,t3_ho4otc,"Who posted this?
I think I am Sara!",t3_ho4otc
743,fxo12rj,t3_ho4otc,"Such a beautiful story, it literally brought tears in my eyes. Learning about acts of kindness like these really motivates me to become a kinder person, like them!",t3_ho4otc
744,fxry5cc,t3_ho4otc,"Wow ok, this is actually real. 
I saw this on Instagram, saw your handle, “bella3774” then came to Reddit to investigate. Because this letter was given to a high school friend of mine. Her name is actually “Sarah” Bates Black. This was originally shared on FB. 
I’m curious how you found it op?",t3_ho4otc
745,fxteb31,t3_ho4otc,Scripted fake,t3_ho4otc
746,fxxouk0,t3_ho4otc,"My saddest day as a barber was one day that a neighbor that i saw everyday in my neighborhood entered for a haircut, he asked me with a smile to trim eveything off, even the eyebrows, he tipped me with 20€, wished me all the best to me and my barbershop, left and i never saw him again...",t3_ho4otc
747,fxzsbsm,t3_ho4otc,/r/MadeMeBawl,t3_ho4otc
748,fxzsh4v,t3_ho4otc,As p,t3_ho4otc
749,fy1khuv,t3_ho4otc,Hair is everything,t3_ho4otc
750,fy29wpw,t3_ho4otc,https://discord.gg/SU8YBn,t3_ho4otc
751,fy30vnk,t3_ho4otc,Oh my gosh this is so sweet,t3_ho4otc
752,fy7iov1,t3_ho4otc,"Wow this is so nice. Unfortunately I began reading it as Dear Santa,.....",t3_ho4otc
753,fye0xgx,t3_ho4otc,This is the top post on the sub,t3_ho4otc
754,fygzmdh,t3_ho4otc,"What's free to give away (kindness), can be priceless to another.",t3_ho4otc
755,fypwtc0,t3_ho4otc,This is beautiful,t3_ho4otc
756,fznmhmk,t3_ho4otc,Oof!  This is the biggest little thing ever!💕,t3_ho4otc
757,g0co7wz,t3_ho4otc,Excuse me this sub is /r/MadeMeSmile not /r/MadeMeBawlLikeABaby,t3_ho4otc
758,g0eti4s,t3_ho4otc,I'm not crying. I'm not crying. I'm not crying,t3_ho4otc
759,g0g4987,t3_ho4otc,"I cried a little, but my brain thought I was smiling. Interesting beings, is what we are.",t3_ho4otc
760,g12eae2,t3_ho4otc,I cherish this letter,t3_ho4otc
761,g1w5vho,t3_ho4otc,Nicw,t3_ho4otc
762,g2957ml,t3_ho4otc,"Awe, my ❤️ that’s so sweet and sad at the same time",t3_ho4otc
763,g2jf02v,t3_ho4otc,"Sometimes, not often but sometimes, humanity does not suck.",t3_ho4otc
764,g2zoeoz,t3_ho4otc,Damn. Damn.,t3_ho4otc
765,g3m10ln,t3_ho4otc,This brought tears to my eyes 🥺,t3_ho4otc
766,g4jsncd,t3_ho4otc,"I’m not crying, you’re crying!",t3_ho4otc
767,g4txdny,t3_ho4otc,More like made me cry,t3_ho4otc
768,g5rjqus,t3_ho4otc,This was one of the most touching things I've read all year. Thank you so very much for sharing.,t3_ho4otc
769,g631mor,t3_ho4otc,I would cry straight away and would need a coffee and a ciggi,t3_ho4otc
770,g72faz3,t3_ho4otc,"Sometimes if it is just one life, if it is the right life, that’s enough.",t3_ho4otc
771,g7thwwi,t3_ho4otc,"well, im crying  
my great grandma just recently passed away, and this is so relevant aaaaaaa",t3_ho4otc
772,g8x7fzg,t3_ho4otc,"Well, I got my cry in for the week.",t3_ho4otc
773,ga9rf94,t3_ho4otc,r/mademesmilecry,t3_ho4otc
774,gb4ohrx,t3_ho4otc,Ok ... that made me cry. So beautiful.,t3_ho4otc
775,gbx2ae9,t3_ho4otc," This is really beautiful. I am so sorry for his life, but he is a wonderful person to be able to still see the positive and to bring positivity into someone else's life too.",t3_ho4otc
776,gbzsir1,t3_ho4otc,God bless this man's soul.,t3_ho4otc
777,gc0zhuu,t3_ho4otc,"There are so many people doing jobs, that might not directly appear to be so profound, but sometimes that really isn't the case. We all have the chance to make a difference.",t3_ho4otc
778,gc1uno0,t3_ho4otc,I just cried x,t3_ho4otc
779,ge2be3r,t3_ho4otc,Amazing what each of us could do with our jobs when we treat people like they’re special.,t3_ho4otc
780,gegg7qu,t3_ho4otc,"Dear Sara,

Thanks for being an awesome person.",t3_ho4otc
781,geotpay,t3_ho4otc,"Thank you, from someone in another thankless profession. You made me fucking cry.",t3_ho4otc
782,geufykf,t3_ho4otc,MadeMeTearUp*,t3_ho4otc
783,gfaboi4,t3_ho4otc,"This is so beautiful. If everyone took the time to be as kind in whatever their profession is, like yourself, the world would be much better for it.",t3_ho4otc
784,gfws67m,t3_ho4otc,I am not crying you crying,t3_ho4otc
785,ggcf1c9,t3_ho4otc,"Thats disgusting, I had a girlfriend like that once whom I cared dearly for still do but she had depression which I took seriously read book and even got a diploma in.  Nota single day went past that I didn't acknowledge her and tell her how beautiful she was. To this day I still think she is the most gorgeous, beautiful person from head to toe. she is really amazing, I still send messages but not sure if she is around any more cause I never got a response. she is perfect.

I hope you put that hairdresser in her place",t3_ho4otc
786,ghdil61,t3_ho4otc,Too long to read. I wish new year brought me easy smiles.,t3_ho4otc
787,ghyr4eu,t3_ho4otc,For the record I use to think you were EVERYTHING. I felt like I meant something to you too.,t3_ho4otc
788,fxfobba,t3_ho4otc,"And now I'm crying on break at my construction job...thanks for that lol. Seriously though, this is so moving!",t3_ho4otc
789,fxfq2n5,t3_ho4otc,"#Wow, where did these onions come from?",t3_ho4otc
790,fxfowmx,t3_ho4otc,"Now I’m crying at work, but it’s well worth it",t3_ho4otc
791,fxfw5p1,t3_ho4otc,"This gutted me. Edit: with sadness!! 
I’m terrified of dementia taking my mom.",t3_ho4otc
792,fxfo49p,t3_ho4otc,"Stop this now, I’m not ready for my daily sob.",t3_ho4otc
793,fxfue95,t3_ho4otc,Okay I’m gonna go cry like a baby now because this was too cute.,t3_ho4otc
794,fxfuin9,t3_ho4otc,Wow! This made me year up a bit. Jesus Christ it's nice to see decent people still exist.,t3_ho4otc
795,fxfuvr5,t3_ho4otc,Thank god I work from home so no one saw me cry like a baby,t3_ho4otc
796,fxfpas6,t3_ho4otc,"Honestly,  y'all,  r/MadeMeCry needs to be a thing",t3_ho4otc
797,fxfv0wn,t3_ho4otc,"Damn, someones must be cutting onions in my house. Thanks for sharing.",t3_ho4otc
798,fxfodll,t3_ho4otc,dammit...now im crying,t3_ho4otc
799,fxfosyt,t3_ho4otc,They may have put the thunder made me smile but I have tears running down my face,t3_ho4otc
800,fxfp1wo,t3_ho4otc,Honestly r/mademecry,t3_ho4otc
801,fxfpnmu,t3_ho4otc,/mademecrylikeababy,t3_ho4otc
802,fxfq7qr,t3_ho4otc,"Yep, crying now at work. Such a simple act can mean so much",t3_ho4otc
803,fxfqifc,t3_ho4otc,This bought tears to my eyes omg,t3_ho4otc
804,fxfqmx4,t3_ho4otc,My eyes are leaking,t3_ho4otc
805,fxfrj1p,t3_ho4otc,I'm not crying. You're crying.,t3_ho4otc
806,fxfronp,t3_ho4otc,This is enough to make a grown man cry,t3_ho4otc
807,fxfroy1,t3_ho4otc,I cry,t3_ho4otc
808,fxfw5i5,t3_ho4otc,"Ugly crying, this is beautiful.",t3_ho4otc
809,fxfp3jq,t3_ho4otc,"Damnit I'm at work right now, I can't be crying",t3_ho4otc
810,fxfpwux,t3_ho4otc,More like MadeMeCry!,t3_ho4otc
811,fxftfhh,t3_ho4otc,"Ok, this brought tears to my eyes",t3_ho4otc
812,fxi97cr,t3_ho4otc,FAKE🤢🤮💩,t3_ho4otc
813,fxfojye,t3_ho4otc,"I’m not crying, you are.",t3_ho4otc
814,fxfp6ki,t3_ho4otc,❤️💕😭,t3_ho4otc
815,fxfsax9,t3_ho4otc,"I'm not crying, you're crying.",t3_ho4otc
816,fxfw2i3,t3_ho4otc,[deleted],t3_ho4otc
817,fxfrwba,t3_ho4otc,"Told myself I wouldn’t cry today, but this post obviously had other plans for me.",t3_ho4otc
818,fxfs1h5,t3_ho4otc,Is this r/mademesmile or r/mademecry? Cause 😭,t3_ho4otc
