,comment_id,comment_parent_id,comment_body,comment_link_id
387,fxg9d6j,t3_ho4otc,I translated this to my mom and she legit got tears :(,t3_ho4otc
388,fxg9jt4,t3_ho4otc,"I’m not crying, you’re crying.",t3_ho4otc
389,fxg9l5x,t3_ho4otc,"God damn, it is dusty in here.",t3_ho4otc
390,fxg9p74,t3_ho4otc,"I assure you, I’m like....the manliest of men. Super manly. This still made me tear up a bit",t3_ho4otc
391,fxg9qv8,t3_ho4otc,"My mom cut hair for before she had kids. She's easily the most kind and compassionate woman I know and would do a lot to help people with complicated hair issues or in financial hardship, even though she was never super financially stable either. My favorite story of hers is that a customer came in with hair grown past her hips, she had tears in her eyes tellling my mom that she fell asleep with gum and it got stuck in her hair creating a massive rats nest. She had been to multiple hair shops asking for help and they all said the best they could do was cut damn near all of it off, but she was very attached to her hair and didn't want to do that. My mom sat with her for hours carefully combing her hair until she could get the gum dislodged. For the time and money that took, my mom really didn't have to do that for her. But she remembers it being the most rewarding feeling seeing her so happy and grateful afterwards.",t3_ho4otc
392,fxg9vu3,t3_ho4otc,I used to work in retail a few years back and i remember this old man who came in quite often and we used to chat for some time about everything and all in between. Then for some reason he did not show up for a couple of months until one day I saw him coming in and i could see that his skin was all yellow and he looked very tired. He didn't want to buy anything but he just told me that he had been diagnosed with cancer and they had stopped the treatment and he told me that he was gonna die very soon. I didn't really know how to react and I don't think he did either. He said that he had been alone for a long time and that he had cherished the moments when he was in our store and could talk to us. It was quite sureal that we as a retail store was such a big part of his life that he wanted to come in and say goodbye for a last time. Needless to say i had to take a moment after he had left but for some reason it was very beautiful.,t3_ho4otc
393,fxg9yxu,t3_ho4otc,r/mademecry,t3_ho4otc
394,fxg9zeb,t3_ho4otc,I m gonna cry,t3_ho4otc
395,fxga6b1,t3_ho4otc,Is it dusty in here?,t3_ho4otc
396,fxga75a,t3_ho4otc,Beautiful ❤️,t3_ho4otc
397,fxga9gy,t3_ho4otc,Made me smile with watery eye(s),t3_ho4otc
398,fxgaa1y,t3_ho4otc,If I received a letter like this I would cry,t3_ho4otc
399,fxgaavf,t3_ho4otc,"Wow, that letter is incredibly empowering. Can we please normalize this sort of gratification? I think we could all use more of this.",t3_ho4otc
400,fxgag8y,t3_ho4otc,[deleted],t3_ho4otc
401,fxgaizd,t3_ho4otc,No doubt! That's a powerful profession. Creating beauty for other people is a wonderful gift.,t3_ho4otc
402,fxgao8s,t3_ho4otc,"I worked customer service for a decade. Notes like this are so incredibly rare. I did outstanding work daily but only received two notes in that time. So, in over 300,000 customer interactions over the course of ten years, only two people took the time to write a note. 

I have both of them framed.  (The notes; I didn’t have the people framed.)",t3_ho4otc
403,fxgasax,t3_ho4otc,Fucking dusty today,t3_ho4otc
404,fxgastk,t3_ho4otc,Should be posted to made me cry. So simple and so touching.,t3_ho4otc
405,fxgavza,t3_ho4otc,People need to write more letters,t3_ho4otc
406,fxgay2r,t3_ho4otc,"I once got a letter like that. I was a resident on ER duty and a woman came in with a stroke. We were a rural hospital so I explained everything that was happening to her and her husband and quickly organized a transport to a stroke center. A few days later, she was sent back to wait in our hospital for her bed in rehab. 

About 18 months later, she came to my ward for a simple infection that needed i.v. Antibiotics. She talked a lot without really being able to form a complete sentence or make sense at all (Wernicke aphasia). This was all that seemed to have remained from her stroke but it was so bad, I could hardly understand her. I felt really bad for her, but she seemed very happy all the time. After two days, her husband caught me in the hallway and gave me a letter, thanking me profusely. In the letter, he had written how eternally thankful they were to me for helping in his wife's recovery. Specifically that I took the time to explain everything to them, eventhough it had to be a stressful moment for me. How she had re-learned to walk and even ride a bike. And how they are now able to go bird-watching together - something they didn't thing would be possible after the stroke. The letter included a blue feather from some rare bird they had seen. They said it was extremely rare to find a feather like that and they wanted me to have it. 

You Bett I still have this letter s d the feather. I reread it often when I struggled with my profession and it has been an eye-opener. I realized that even the smallest thing I do for people in acute crisis can have the most profound impact that goes way beyond the physical necessity. And that I always need to be aware of that and empathic to the crisis my patients are in.",t3_ho4otc
407,fxgayu9,t3_ho4otc,this is so beautiful wtf.,t3_ho4otc
408,fxgazt1,t3_ho4otc,I got something in my eye,t3_ho4otc
409,fxgb1z1,t3_ho4otc,I really do be crying at work,t3_ho4otc
410,fxgbegj,t3_ho4otc,I’m crying with a stupid smile on my face.,t3_ho4otc
411,fxgbhf5,t3_ho4otc,Yea I'm now totally bawling.,t3_ho4otc
412,fxgbhs8,t3_ho4otc,Damn. A whole animated Pixar short came into view as i was reading that.,t3_ho4otc
413,fxgbi2f,t3_ho4otc,This is great. Yesterday I showed my 10yo niece and nephew (they're twins) faith in humanity videos on youtube and they we surprised at so many people helping others. We need more of this.,t3_ho4otc
414,fxgbkl4,t3_ho4otc,I’m not crying. You are 🥰,t3_ho4otc
415,fxgbmjv,t3_ho4otc,"Such a sweet letter, made my heart melt :’)",t3_ho4otc
416,fxgbsyj,t3_ho4otc,And then Jesus clapped...,t3_ho4otc
417,fxgbu27,t3_ho4otc,Awwwwwww,t3_ho4otc
418,fxgbwgi,t3_ho4otc,😭😭😭😭😭😭😭 OMG this is so sweet and sad at the same time,t3_ho4otc
419,fxgbxc5,t3_ho4otc,Damn that hit me,t3_ho4otc
420,fxgc54p,t3_ho4otc,Not all heros wear capes...,t3_ho4otc
421,fxgc8f4,t3_ho4otc,"How is this ""made me smile"" material?",t3_ho4otc
422,fxgcd0s,t3_ho4otc,Maintaining someone's dignity is an amazing thing to do. And just by doing what you do everyday.,t3_ho4otc
423,fxgcfbv,t3_ho4otc,Wish it was handwritten,t3_ho4otc
424,fxgci6e,t3_ho4otc,Ugh my eyes are sweating.,t3_ho4otc
425,fxgci6j,t3_ho4otc,"Thank you for sharing this message, it is beautiful! If we would spend more time caring and appreciating one another the world would be a better place.",t3_ho4otc
426,fxgcjqy,t3_ho4otc,"This didn't make me smile😒😒😒😒


Made me cry🤧🤧😭😭",t3_ho4otc
427,fxgclf2,t3_ho4otc,"This almost made me cry.

The Best hairdresser I ever had did my hair every time between the ages of 14 and 18. The last time was for my high school graduation. I wasn't opposed to having any colour or style of hair so I sort of just let her go crazy and experiment. I would literally give her free reign to do whatever she wanted and I loved it every fucking time (and she loved me for it).

She had black and white portrait tattoos on her biceps of Elvis Presley and Johnny Cash, short blonde hair (kind of pinup style) and I thought she was so fucking cool. And as an ugly duckling kind of awkward teenager with low self esteem, she made me feel so pretty and confident.

I wish I could find her again so badly but all I have is a first name and a description.

Marissa from Calgary, if you're reading this by some fucking miracle, please DM me! Or if you know her, please DM me. I would love for her to do my hair again even though it's been a decade since I saw her last. And in that decade, I've NEVER found someone anywhere near as great as she was.",t3_ho4otc
428,fxgcnnc,t3_ho4otc,"When you treat people right, u never know how beneficial it was for them",t3_ho4otc
429,fxgcp1w,t3_ho4otc,Aww this is actually so wholesome :(,t3_ho4otc
430,fxgcpva,t3_ho4otc,"No, I’m not crying. You’re crying",t3_ho4otc
431,fxgcqud,t3_ho4otc,"I thought this was ""made me smile""? 

whimpering like a bawler.",t3_ho4otc
432,fxgct45,t3_ho4otc,"mom, people are confusing r/mademecry with r/mademesmile again.",t3_ho4otc
433,fxgctwy,t3_ho4otc,"That wasn’t the mirror grandpa,that was a picture of her sister.",t3_ho4otc
434,fxgcxb0,t3_ho4otc,r/mademecry,t3_ho4otc
435,fxgd1lp,t3_ho4otc,What? No I'm not crying..  you're crying!,t3_ho4otc
436,fxgdd6b,t3_ho4otc,Well there's a punch right in the feels.,t3_ho4otc
437,fxgddns,t3_ho4otc,This is unbearably sad. Happy ending but just oh my god. Last haircut. Awful.,t3_ho4otc
438,fxgdkcf,t3_ho4otc,Where do you cut hair I might be connected to them!,t3_ho4otc
439,fxgdlqg,t3_ho4otc,*Goddamn onions*,t3_ho4otc
440,fxgdnuv,t3_ho4otc,And now I’m ugly crying.,t3_ho4otc
441,fxgdv96,t3_ho4otc,"Wonderful. I guarantee this letter will be cherished by the recipient forever too. We're all looking for meaning, and something like this really makes a person feel like they made a difference.",t3_ho4otc
442,fxgdyz2,t3_ho4otc,Damn onions.,t3_ho4otc
443,fxgdz2p,t3_ho4otc,More like made me cry,t3_ho4otc
444,fxge069,t3_ho4otc,Ahh shit.... Fucking onions cutters going at it again..,t3_ho4otc
445,fxge0c6,t3_ho4otc,I love people.,t3_ho4otc
446,fxge8l4,t3_ho4otc,This is so sad and is making me cry. It's so nice that a simple day can become such a great memory.,t3_ho4otc
447,fxge8us,t3_ho4otc,Aaaaaand I’m sobbing,t3_ho4otc
448,fxge9rn,t3_ho4otc,Jesus Christ here I am with a lump in my throat and misty eyes while taking a break from fixing a shipping error.,t3_ho4otc
449,fxgeh5p,t3_ho4otc,I'm not crying you're crying,t3_ho4otc
450,fxgehrs,t3_ho4otc,r/MadeMeCryLikeABaby,t3_ho4otc
451,fxgei64,t3_ho4otc,"STOP IT WITH THE ONIONS!

This is such a genuine and heartwarming letter. Bless you.",t3_ho4otc
452,fxgepjd,t3_ho4otc,"I’m not crying, you’re crying 😭",t3_ho4otc
453,fxgeqhd,t3_ho4otc,Made me smile...More like made me cry 😭,t3_ho4otc
454,fxgeusa,t3_ho4otc,If I could I would give you gold,t3_ho4otc
455,fxgew54,t3_ho4otc,THE WORLD IS BEAUTIFUL!! Don’t let anyone tell you different. If they are then they are having a bad time. Change their opinion. I really needed to see this light in such a dark time.,t3_ho4otc
456,fxgexjn,t3_ho4otc,"Sure, I don’t mind tearing up in the middle of the day.  This is fine.",t3_ho4otc
457,fxgey7u,t3_ho4otc,How dare you make me tear up? This is absolutely beautiful.❤️,t3_ho4otc
458,fxgeyli,t3_ho4otc,More like MadeMeCry,t3_ho4otc
459,fxgf5mg,t3_ho4otc,More like made me tear up. Very touching.,t3_ho4otc
460,fxgf73e,t3_ho4otc,u/MPKallday 🥺,t3_ho4otc
461,fxgf7cw,t3_ho4otc,"Damn, my dad died in April, with the onset of vascular dementia and this was a tough read. I’m really happy you have this happy day to think back on, and similarly I have pleasant memories myself. Have a great day.",t3_ho4otc
462,fxgffbb,t3_ho4otc,Made me tear up a bit.,t3_ho4otc
463,fxgffmv,t3_ho4otc,I’m not crying- you’re crying!,t3_ho4otc
464,fxgffxl,t3_ho4otc,Well that didn’t make me just smile but also tear up.,t3_ho4otc
465,fxgfls6,t3_ho4otc,"I'm not crying, you are!",t3_ho4otc
466,fxgfmby,t3_ho4otc,Geriatric nurse here. Aww my heart melted.,t3_ho4otc
467,fxgfn3x,t3_ho4otc,"I’m not crying, it’s just been raining on my face.",t3_ho4otc
468,fxgfpn3,t3_ho4otc,I hope someone is smiling cause this has me tearing up,t3_ho4otc
469,fxgfprt,t3_ho4otc,Fake. These things always add way to much detail for a third party to picture it.,t3_ho4otc
470,fxgfr6u,t3_ho4otc,Sadly this poor woman will also have to deal with the typical asshole who won’t wear a mask for her health,t3_ho4otc
471,fxgfrrh,t3_ho4otc,"This is a very sweet and lovely gift you gave Sara. I'm sure it warmed her heart and bought forth tears. I Sir, thank you very much myself. For the last several months, we all have been going through all the political venom and vitriol, not too mention the pandemic attacking our country. Your letter lifted my heart and hope for survival.",t3_ho4otc
472,fxgfvcy,t3_ho4otc,Fuck these stupid hormones.,t3_ho4otc
473,fxgfvgb,t3_ho4otc,And crying. Beautiful.,t3_ho4otc
474,fxgg0qp,t3_ho4otc,"no, you’re cutting onions.",t3_ho4otc
475,fxgg2aj,t3_ho4otc,Not crying.,t3_ho4otc
476,fxgg3lc,t3_ho4otc,I’m about to cry tbh,t3_ho4otc
477,fxgg74w,t3_ho4otc,Why am I crying over a haircut?,t3_ho4otc
478,fxgg7b0,t3_ho4otc,"I am having a rough day, and this started the water works... but in a good way.",t3_ho4otc
479,fxgg875,t3_ho4otc,😭,t3_ho4otc
480,fxgg9gu,t3_ho4otc,"This didn't just make me smile, it deffinitely made me cry. Now my buddy is staring at me thinking I'm on his couch cause I'm depressed and randomly broke down xD",t3_ho4otc
481,fxgg9nt,t3_ho4otc,Damm man is someone cutting onions here?,t3_ho4otc
482,fxggb0y,t3_ho4otc,Made me smile and also made me cry. May she rest in peace,t3_ho4otc
483,fxggg7p,t3_ho4otc,"To make that lady’s day (and also her husband’s) over and over is delightful. As someone who has a restaurant, I’m always thrilled when someone makes a point to compliment my staff. I have done the same at other establishments because 90% of the time feedback is negative.",t3_ho4otc
484,fxggnny,t3_ho4otc,It must be dusty in here or something.....,t3_ho4otc
485,fxggp3w,t3_ho4otc,Wow as a hairstylist this is the type of stuff we work for!!! Being able to brighten someone’s day is one of the most rewarding parts of the job. Getting your hair done can be a scary time for some so I think a lot of hairstylists just do these things without a second thought!,t3_ho4otc
486,fxggrpq,t3_ho4otc,Gave me goose bumps.,t3_ho4otc
487,fxggzd0,t3_ho4otc,Why I cum onto my dog’s the camera,t3_ho4otc
488,fxgh38m,t3_ho4otc,🥺🥺,t3_ho4otc
489,fxgh5o8,t3_ho4otc,Fuuuuuck. That's heartbreaking and making all in one..,t3_ho4otc
490,fxgh8p4,t3_ho4otc,"Being in the service industry, receiving thanks and compliments really make our day, week, sometimes month as well. Great story.",t3_ho4otc
491,fxgh9o7,t3_ho4otc,Oh my god I’m heartbroken,t3_ho4otc
492,fxghaau,t3_ho4otc,"Fuck man, crying.",t3_ho4otc
493,fxgham9,t3_ho4otc,Crying 😢,t3_ho4otc
494,fxghko3,t3_ho4otc,Smile? This made me tear up a bit.. :(,t3_ho4otc
495,fxghon0,t3_ho4otc,Made me cry,t3_ho4otc
496,fxghqlu,t3_ho4otc,Beautiful.,t3_ho4otc
497,fxghv84,t3_ho4otc,"Hmm, all of a sudden I'm recalling allot of harsh comments and criticism from people about those needing to get a hair cut a couple months ago, and how we need to just shut the f up and stay home?",t3_ho4otc
498,fxghxf3,t3_ho4otc,"Hells yes. A good barber makes a person new. For the last few years, I finally have a regular guy. We talk about our kids, he knows my cut without asking, and serves me up a shot of homemade whisky from under the counter when I come it. Up until I started seeing this guy, I didn’t really have a set place; just whatever was available when I needed a cut. Total life changer. Now I feel like a adult. I’ll probably keep seeing this guy for the next twenty years, or until my hair falls out. Hair dressers are so, so important.",t3_ho4otc
499,fxgi38r,t3_ho4otc,Omg,t3_ho4otc
500,fxgi8vh,t3_ho4otc,Why is it suddenly raining inside?! Oh I’m crying.  damn.,t3_ho4otc
501,fxgi9s4,t3_ho4otc,Well now I’m tearing up first thing in the morning. Thanks heartfelt haircuts!,t3_ho4otc
502,fxgib9e,t3_ho4otc,I cried. That’s a beautiful letter.,t3_ho4otc
503,fxgijdy,t3_ho4otc,"r/mademeweep


Jeepers... 😭",t3_ho4otc
504,fxgik6j,t3_ho4otc,Damn ninjas cutting onions again,t3_ho4otc
505,fxgik6p,t3_ho4otc,RIP SCREW,t3_ho4otc
506,fxgill7,t3_ho4otc,"Thanks, that made me cry and smile.",t3_ho4otc
507,fxgivpe,t3_ho4otc,Way to go Sara,t3_ho4otc
508,fxgjc0o,t3_ho4otc,"Jesus, this made me cry 😭😔",t3_ho4otc
509,fxgjc9a,t3_ho4otc,"Oh I'm sorry, I didn't realize this way r/MadeMeWeepLikeALittleBaby",t3_ho4otc
510,fxgjd4u,t3_ho4otc,More like made me cry,t3_ho4otc
511,fxgjibl,t3_ho4otc,"When my dad passed away he didn’t look anything like himself. The girl who worked on my dad for his viewing made him look healthy, he passed from cancer. I was absolutely blown away by her work. I sent the whole team pastries, a letter thanking her, and a letter to her boss telling her what an amazing job she had done and the peace it brought us to see my dad look like my dad. I am now friends with her and we talk a lot like we are old friends. People should know when they have impacted someone’s life even during a difficult time.",t3_ho4otc
512,fxgjksg,t3_ho4otc,Make it your goal to tell people who were helpful or doing a good job that you appreciate it.,t3_ho4otc
513,fxgjmie,t3_ho4otc,"Omg, my heart is melting!",t3_ho4otc
514,fxgjmxy,t3_ho4otc,ಥ_ಥ,t3_ho4otc
515,fxgjsob,t3_ho4otc,"I write this with tears in my eyes. My mom has had dementia for over a decade. It's a horrible, horrible disease. One of her favorite things to get done at her nursing home is her hair and nails. She may not remember my name every time I call (different state) but she still hangs onto to her dignity the best she can. God bless those people that help my mom do that - from the nurses to the sylists - they are there for her when I can't be.",t3_ho4otc
516,fxgjtlr,t3_ho4otc,"Fuck, this got me.",t3_ho4otc
517,fxgjud4,t3_ho4otc,"I still suffer from low self esteem but my hair had gotten super long and I hate the salon because I don’t like people touching my head (I know, weird). I had been debating cutting my hair for months and then quarantine happened and the next chance I could, I booked an appointment. The whole thing took about 15 mins because I have really thin hair and I felt so confident. I took pictures of myself which I hadn’t in months. It may have been just another haircut to that lady, but it was amazing for me.",t3_ho4otc
518,fxgjwwf,t3_ho4otc,"Oof. Lots of onion cutting going on today, eh?",t3_ho4otc
519,fxgjxsl,t3_ho4otc,"A few years ago I was in a city for work and stopped by this deli place for lunch like 3/5 days. On my last day after I got done eating I went up to the counter and asked if I could talk to a manager. When the manager came up I told them how pleased I was with the quality of the food, the speed, cleanliness and general atmosphere. As I was telling him this, he visibly lightened up. I guess they were a new test franchise and were under a lot of pressure to perform well in the area. He seemed really happy to hear this positive news.",t3_ho4otc
520,fxgk011,t3_ho4otc,Wow this made me tear up,t3_ho4otc
521,fxgkarh,t3_ho4otc,sonofabitch that hits right in the feels,t3_ho4otc
522,fxgkesf,t3_ho4otc,Made me cry,t3_ho4otc
523,fxgkfmn,t3_ho4otc,"This letter is fake. You can tell by it having a meaningful impact on me, but I have decided that life is void of meaning and everything is for fake internet points.",t3_ho4otc
524,fxgkg7f,t3_ho4otc,"Oh my god I- 

This is beautiful",t3_ho4otc
525,fxgkhe4,t3_ho4otc,IM NOT CRYING,t3_ho4otc
526,fxgki23,t3_ho4otc,It's a terrible day for rain,t3_ho4otc
527,fxgkkeh,t3_ho4otc,"Be thankful is always nice. 

&#x200B;

As a retail worker, it's always nice to get a thank you from customers.",t3_ho4otc
528,fxgkkwa,t3_ho4otc,"The haircut my wife got just after she started chemo was the hottest I ever saw on her. 

Two days later, her hair started falling out in chunks and she had me shave it with my beard trimmer as she cried over the bathtub.",t3_ho4otc
529,fxgknda,t3_ho4otc,Enough to make a grown man cry,t3_ho4otc
530,fxgkogt,t3_ho4otc,There was a similar letter on reddit a few weeks ago. Anyone have a link to that one,t3_ho4otc
531,fxgksno,t3_ho4otc,More like mademecry. That’s very humbling and sweet; it’s important to remember the little things and moments in life.,t3_ho4otc
532,fxgkwgp,t3_ho4otc,F,t3_ho4otc
533,fxgl1gg,t3_ho4otc,this sincerely made me well up.,t3_ho4otc
534,fxgl5lz,t3_ho4otc,Made Me Cry*,t3_ho4otc
535,fxgl654,t3_ho4otc,Terrible day for rain.,t3_ho4otc
536,fxgl7fi,t3_ho4otc,This made me all teary,t3_ho4otc
537,fxgl7y3,t3_ho4otc,This is really lovely on all sides,t3_ho4otc
538,fxglemp,t3_ho4otc,I lost my mom earlier this year to cancer that was unfortunately too late of a diagnosis. This is the type of post that really hits so damn close to home.,t3_ho4otc
539,fxglhs6,t3_ho4otc,Hows it going learning to cut hair while crying uncontrollably cause thats the boat id be in forever after this,t3_ho4otc
540,fxglmgh,t3_ho4otc,This made me cry. So so nice.,t3_ho4otc
541,fxglyas,t3_ho4otc,I was not ready to cry over someone getting a haircut today,t3_ho4otc
542,fxgmbkt,t3_ho4otc,This made me smile and cry at the same time. Thank you for posting,t3_ho4otc
543,fxgmj2j,t3_ho4otc,How the hell a few paragraphs can turn me into crying mode?,t3_ho4otc
544,fxgmlnt,t3_ho4otc,/r/MadeMeCry,t3_ho4otc
545,fxgmm5o,t3_ho4otc,More like r/mademesoblikeababy,t3_ho4otc
546,fxgmm7k,t3_ho4otc,"To love a woman that much you’re grateful a stranger makes her smile over a haircut. 

I miss that!",t3_ho4otc
547,fxgmpnm,t3_ho4otc,"No, you’re crying.",t3_ho4otc
548,fxgmwqg,t3_ho4otc,"and I'm crying

this is beautiful!",t3_ho4otc
549,fxgmyd4,t3_ho4otc,Im not crying you are,t3_ho4otc
550,fxgn10l,t3_ho4otc,Oh beautiful. So glad he sent this to her. Special for all of them!,t3_ho4otc
551,fxgnbhr,t3_ho4otc,It's mademesmile or mademecry ?,t3_ho4otc
552,fxgndxy,t3_ho4otc,"It’s sobering to know this will be all of us at some point, just watching our loved ones leave us one by one.",t3_ho4otc
553,fxgneff,t3_ho4otc,Genuinely tearing up. That's such a beautiful letter.,t3_ho4otc
554,fxgnvvf,t3_ho4otc,Damn...So much onion...,t3_ho4otc
555,fxgnwsq,t3_ho4otc,"I'm not crying, no, not at all.",t3_ho4otc
556,fxgo1co,t3_ho4otc,So cute!,t3_ho4otc
557,fxgo211,t3_ho4otc,Argh!! Why is it suddenly so dusty in here? My eyes....god damn I liked that.,t3_ho4otc
558,fxgogzd,t3_ho4otc,That was lovely,t3_ho4otc
559,fxgol25,t3_ho4otc,"I’m sharing this on every social media platform I use. This needs to reach as many people as possible, I am sure it would make everyone’s day!",t3_ho4otc
560,fxgooay,t3_ho4otc,"Who the hell

Puts just one sentence

In a paragraph",t3_ho4otc
561,fxgp49t,t3_ho4otc,Damn wtf im gons cry,t3_ho4otc
562,fxgpohf,t3_ho4otc,❤,t3_ho4otc
563,fxgprjx,t3_ho4otc,"More like, made me cry.",t3_ho4otc
564,fxgpwo0,t3_ho4otc,Fake,t3_ho4otc
565,fxgq09j,t3_ho4otc,r/mademecry.,t3_ho4otc
566,fxgqbxl,t3_ho4otc,I love this but also heart breaking.,t3_ho4otc
567,fxgr1gt,t3_ho4otc,I'm not crying. I've got something in both my eyes,t3_ho4otc
568,fxgrbp7,t3_ho4otc,More like r/MadeMeCry,t3_ho4otc
569,fxgrmfr,t3_ho4otc,I knew I shouldn't cut those onions...,t3_ho4otc
570,fxgrmsb,t3_ho4otc,That's so sweet omg,t3_ho4otc
571,fxgrnw8,t3_ho4otc,"Made me smile, more like made me cry. This is wholesome but so so sad at the same time.",t3_ho4otc
572,fxgrqt6,t3_ho4otc,Is someone cutting onions in here?,t3_ho4otc
573,fxgrywf,t3_ho4otc,I'm not crying. You're crying. (I might be crying.),t3_ho4otc
574,fxgs3jd,t3_ho4otc,This breaks my heat and makes me beam at the same time,t3_ho4otc
575,fxgs5dz,t3_ho4otc,Made me cry,t3_ho4otc
576,fxgs742,t3_ho4otc,"I’m not crying. You’re crying. Ok, I’m crying.",t3_ho4otc
577,fxgsfug,t3_ho4otc,"Someone give 2,000,000 argentenium",t3_ho4otc
578,fxgsovm,t3_ho4otc,I thought it said dear Santa,t3_ho4otc
579,fxgsp8p,t3_ho4otc,Its supposed to make me smile. Whats going on with my eyes?,t3_ho4otc
580,fxgsukq,t3_ho4otc,I'm not crying. You're crying.,t3_ho4otc
581,fxgt06r,t3_ho4otc,"Shut up, I'm not even crying.",t3_ho4otc
582,fxgt6lx,t3_ho4otc,"Thank you for sharing. I get customer correspondence for a state agency. Compliments are rare, complaints are common, some are oddly petty. I am grateful for the joy and dignity you imparted with your outstanding empathy. Way to go!",t3_ho4otc
583,fxgtexi,t3_ho4otc,r/MadeMeCry,t3_ho4otc
584,fxgtfb1,t3_ho4otc,As a barber this brought tears to my eyes.,t3_ho4otc
585,fxgtkqb,t3_ho4otc,"A hairdresser is equal parts

* Friend
* Therapist
* Psychologist
* Hairdresser",t3_ho4otc
586,fxgtlvl,t3_ho4otc,116k upvotes well deserved,t3_ho4otc
587,fxgu7wk,t3_ho4otc,This is truly amazing. It’s important to remember to always be kind to each other. Especially now.,t3_ho4otc
588,fxgu8qi,t3_ho4otc,"Man, how beautiful. What wonderful compliment to a lovely person.",t3_ho4otc
589,fxguhtb,t3_ho4otc,"Yeah I cut all my hair in quarantine and had to go to the barber few days ago for a job interview. I feel so soo much better and classy with a great haircut, even if my hair is still really short. I looked like a monkey cutting my hair myself",t3_ho4otc
590,fxguvbo,t3_ho4otc,"Oh, cool, so now I'm ugly crying.",t3_ho4otc
591,fxguvvy,t3_ho4otc,Ah damn it. Now I have to make 10 new Reddit accounts just to upvote this 10x.,t3_ho4otc
592,fxguwf5,t3_ho4otc,"I work at a salon and we have a women come in every week for a wash and every couple of weeks she gets a cut. Her stylist is amazing and kind, and her husband stands close by when she gets it done. Her stylist turned to the husband when she finished cutting it and said, “doesn’t she look good?”. The husband leaned over and told her how pretty she was and she responded, “that’s really a sweet of you, but I’m married”",t3_ho4otc
593,fxgux1f,t3_ho4otc,"I came here to smile, not to ugly cry.",t3_ho4otc
594,fxguyl0,t3_ho4otc,I'm crying. that is powerful,t3_ho4otc
595,fxgv9s5,t3_ho4otc,"Wait a minute, this isn't /r/mademecry, you bastard",t3_ho4otc
596,fxgvcet,t3_ho4otc,Great now I am crying at 4 in the morning,t3_ho4otc
