,comment_id,comment_parent_id,comment_body,comment_link_id
327,d5ofh5t,t1_d5o81kl,"And they're seriously telling you.  If their drawer if off so much as a penny, they get written up.  Happen too often, they get canned.

Maybe you haven't worked an honest day in retail, but this is the reality.  If you don't have the change, don't order anything.",t3_4u89p9
328,d5o2nso,t1_d5nvc2k,"No.. You should have enough money for the things you order and buy. And if you don't have enough money for something, order something less expensive. 

",t3_4u89p9
329,d5nurg9,t1_d5ntnve,Especially since it would be more dumb to throw out the ice cream and get nothing from it than to lose $0.36 off the profits,t3_4u89p9
330,d5nuhez,t1_d5ntnve,"The tip goes to the person running the register though, not the manager or the company.",t3_4u89p9
331,d5nyu7j,t1_d5ntnve,I was expecting the next customer in line to demand a similar discount.,t3_4u89p9
332,d5nw086,t1_d5ntnve,"What kind of irrationally employer would do that? 

Where I work we are allowed a $3 over or short for situations where someone is a bit short, and because we have no penny",t3_4u89p9
333,d5o0yag,t1_d5ntnve,"same
",t3_4u89p9
334,d5o75nz,t1_d5ntnve,I was expecting Ted Cruz to punch his wife again.  ,t3_4u89p9
335,d5nsykj,t1_d5nsu0m,[deleted],t3_4u89p9
336,d5nuhep,t1_d5nud0l,"Mine does not. it won't play gifs. It can't use the AR camera in Pokemon go. 

worse phone ever...makes no cents.",t3_4u89p9
337,d5o5l01,t1_d5nud0l,Thanks! makes it easy for me to sign,t3_4u89p9
338,d5o5l8c,t1_d5nupp8,¢ woah!,t3_4u89p9
339,d5nrgzx,t1_d5nr4pd,And tree,t3_4u89p9
340,d5ogw0x,t1_d5of10b,"Anything that is outside a cooler for over 30 Mins has to be tossed, and anything a guest gives us that was in a cooler has to be tossed since we don't know how long it was out. ",t3_4u89p9
341,d5nviyj,t1_d5nv0c4,Yuuuup.,t3_4u89p9
342,d5nwl9m,t1_d5nwikp,I did.,t3_4u89p9
343,d5nr65l,t1_d5nqrch,Add the fact that these guys will continue coming back now and they actually made more tips. ,t3_4u89p9
344,d5nsbsi,t1_d5nqrch,Well yes it would have potentially cost the other employee too. In which case it would be 18 cents each and it seems like if the other guy got upset about losing 18 cents O.P. would have given it to him. Regardless it still would cost the owner nothing which was the original point I was responding to. ,t3_4u89p9
345,d5nw508,t1_d5nqrch,">It could have cost OP *and* the other guy working 36¢, 

$0.18 actually, if you're dividing it between two people.",t3_4u89p9
346,d5nvljm,t1_d5nvejp,I'll remember that!,t3_4u89p9
347,d5o5ovs,t1_d5nvejp,"Exactly right. If a worker bends a rule for me to my benefit, they get a ""X went above and beyond for me today and has ensured I'll be a return customer.""",t3_4u89p9
348,d5o1gu5,t1_d5nvcnw,[deleted],t3_4u89p9
349,d5nsq8g,t1_d5nsksg,A short spotted man *would* tend to attract attention.,t3_4u89p9
350,d5o1c5a,t1_d5nsksg,"Wait, they were at the gym when this happened?

",t3_4u89p9
351,d5nto7q,t1_d5nsfgd,It's a woman. :C,t3_4u89p9
352,d5o03jq,t1_d5nzuwu,"> Seriously, they're nearly impossible to find over here.

[It's all about the velcro, man](http://i.imgur.com/Ne3Mkpw.png)",t3_4u89p9
353,d5ojgtf,t1_d5nzuwu,Sorry for the aggressive stance i took earlier. It's just that change in american wallets gets me madder n' all hell! I don't like change PERIOD.,t3_4u89p9
354,d5nr0hd,t1_d5npvfo,"It's like a roller coaster, but at the bottom of the first hill the track runs out.",t3_4u89p9
355,d5nv11f,t1_d5npvfo,"So, a /r/fiftyfifty for text posts?",t3_4u89p9
356,d5nycn3,t1_d5npvfo,That would be good,t3_4u89p9
357,d5nz4v3,t1_d5nyrpn,That and TV.,t3_4u89p9
358,d5o0b9m,t1_d5o06ql,">maybe they don't like the minimal fees to the credit card companies?

This might be why.

The food was all very decently priced though, and they have to be making profit somehow. I'm sure whatever they're doing is working. It was packed when I went there, and it was around 1:30 in the afternoon. They even passed around baskets of French fries to people waiting.",t3_4u89p9
359,d5ohrh9,t1_d5o06ql,[deleted],t3_4u89p9
360,d5nyfyw,t1_d5nw6m7,It's definitely illegal.,t3_4u89p9
361,d5nzycf,t1_d5nw6m7,It is illegal.,t3_4u89p9
362,d5nxb7d,t1_d5nw6m7,YANAL? ,t3_4u89p9
363,d5oeyco,t1_d5nw6m7,"It depends on the situation and where they are. Delivery drivers are responsible for their money, but staff inside the store is not. ",t3_4u89p9
364,d5nud4v,t1_d5nrjsf,"Ah, the worst of the worst. 

No, I'm just kidding, but I was not expecting IRS agent as the legit answer lol. ",t3_4u89p9
365,d5nrosl,t1_d5nrjsf,"Ah, I see. :)",t3_4u89p9
366,d5nsw08,t1_d5nsr54,Fam the ice cream dude reached in the tip jar and compensated for the 36 cents,t3_4u89p9
367,d5nsu46,t1_d5nsr54,"> Me: Oh hey, it's cool, only $0.36 I take the $0.36 out of the tip jar and put it in the till no big deal!

",t3_4u89p9
368,d5nrrn6,t1_d5nrlcs,"They don't serve it on the rock, they prepare it.",t3_4u89p9
369,d5oc16v,t1_d5obss9,[yeh](http://www.urbandictionary.com/define.php?term=I%27m%20Dead),t3_4u89p9
370,d5ofu6o,t1_d5ofsf5,...what?!,t3_4u89p9
371,d5oz6ka,t1_d5ofh5t,">If their drawer if off so much as a penny, they get written up.

Then why stay there? It's utterly unreasonable. If you can get canned for walking in a certain way, would you seriously want to stay?

This isn't war time. You can get another job.

>If you don't have the change, don't order anything.

Why not? That is entirely unreasonable.

But sure. If a company thinks losing a penny is going to hurt their bottom line to the extent that they're going to heavily inconvenience me by making me carry useless pennies and/or getting 99c in small coins, then they're not going to get my business.

It's just that simple.",t3_4u89p9
372,d5o4qbl,t1_d5o2nso,"I agree, but no one will miss three cents.  Don't waste everyone's time over it.  Such behavior costs the company money.",t3_4u89p9
373,d5o28ln,t1_d5nurg9,Had to convince a smoothie place employee of this when their POS went down after they had already made the next three customers orders and they were just going to throw them out instead of taking the cash we had on us for our orders. ,t3_4u89p9
374,d5o3235,t1_d5nurg9,"How are they losing profits? Surely these tips are intended for the employee, and as such it's his own money he's spending, not the store's?",t3_4u89p9
375,d5r1hp9,t1_d5nurg9,"Yeah it would, too bad some stores dont see it that way.

I once had to case after an elderly couple because they took the small coffee we screwed up and the correct one because ""or else you're basically giving 2 products for the price of 1"".

Only for the coffee to be promptly thrown out when returned
",t3_4u89p9
376,d5nxqwr,t1_d5nurg9,"Depends what kind of profit margin they have, I imagine an ice cream place is probably making more than 36 cents off of each sale though.",t3_4u89p9
377,d5o40iq,t1_d5nurg9,Not necessarily.,t3_4u89p9
378,d5nvrld,t1_d5nuhez,Stealing from you coworkers is a fireable action though. Although it is petty.,t3_4u89p9
379,d5nvsu4,t1_d5nuhez,The persons working the counter that day.,t3_4u89p9
380,d5nuvx0,t1_d5nuhep,No ¢,t3_4u89p9
381,d5nuzam,t1_d5nuhep,[deleted],t3_4u89p9
382,d5nuwyd,t1_d5nuhep,Just...no cents at all.,t3_4u89p9
383,d5nvbvr,t1_d5nuhep,The AR sucks anyways. ,t3_4u89p9
384,d5nv481,t1_d5nuhep,Name this burden of a phone ,t3_4u89p9
385,d5o33bd,t1_d5nuhep,"I don't know why, but this is the best pun I've seen in a while. It's time for some change. Every pun must be this good. ",t3_4u89p9
386,d5ny9ai,t1_d5nuhep,"Can't even okay the damned game. 

\#Just$75PhoneThings",t3_4u89p9
387,d5nyw98,t1_d5nuhep,">It can't use the AR camera in Pokemon go.

Oh man, I feel you. I got a new phone and afterwards I realized it can't do AR. Bummer.",t3_4u89p9
388,d5o0aga,t1_d5nuhep,"What is it, so I never buy one",t3_4u89p9
389,d5o17xw,t1_d5nuhep,Windows Phone?,t3_4u89p9
390,d5nsr2e,t1_d5nrgzx,And the,t3_4u89p9
391,d5o80dy,t1_d5nwl9m,Would you mind sharing the link?,t3_4u89p9
392,d5nwc5e,t1_d5nw508,"I'm surprised it took somebody this long to point that out. I knew that, but at the same time, you knew what I meant. So.",t3_4u89p9
393,d5o1uyd,t1_d5o1gu5,Yeah. I'm like Sullivan from Monsters Inc.  fear me.,t3_4u89p9
394,d5o3i5x,t1_d5o1gu5,Kind of unnecessary there buddy ,t3_4u89p9
395,d5nue4d,t1_d5nsq8g,GOOD POINT,t3_4u89p9
396,d5nyjhs,t1_d5nto7q,Probably why he doesn't him. ,t3_4u89p9
397,d5o099j,t1_d5o03jq,But I like my leather wallet D:,t3_4u89p9
398,d5nt1wq,t1_d5nr0hd,So the last rollercoaster made on every map of Rollercoaster Tycoon?,t3_4u89p9
399,d5o5gg3,t1_d5nz4v3,And that newfangled rap music.,t3_4u89p9
400,d5oj33a,t1_d5ohrh9,I'm sure they are nice people. But my point is that it would be cheaper for them to just buy credit card scanners. Not to mention its way more convenient for the customer. I hardly carry cash on me and cash only places are a pain for me. And I'm sure I'm not the only one. ,t3_4u89p9
401,d5oirsz,t1_d5oeyco,"Wish I knew this back at my first job. Shady shift manager sent me to clean bathrooms and took a $50 bill from the register while I was cleaning. I noticed it was gone when I got back but figured he put it in the safe. Nope, he took it. Drawer $50 short. It came out of my paycheck. ",t3_4u89p9
402,d5nugqp,t1_d5nud4v,"The funny thing there is a position even more aggressive called a revenue *officer* which most people wouldn't recognize but you really, really don't want to have assigned to you. A revenue agent is like a sibling tattletale, a revenue officer is a pissed off parent with a heavy wooden spoon.",t3_4u89p9
403,d5nswrf,t1_d5nsu46,[deleted],t3_4u89p9
404,d5nrx6k,t1_d5nrrn6,Ohhhhh okay. That's where the confusion is coming in. I know they're more known for their singing. Never thought twice about them preparing it on a granite counter because who cares.,t3_4u89p9
405,d5ocdqx,t1_d5oc16v,[My bad](http://imgur.com/HghTb9B),t3_4u89p9
406,d5ofvfh,t1_d5ofu6o,"Next time you're there, check out the countertop.  They have stone countertops.",t3_4u89p9
407,d5pk3bc,t1_d5oz6ka,"Get the F out.  You either have the right amount, or you don't get their product.  Adults understand this.  Children do not.",t3_4u89p9
408,d5sgdky,t1_d5oz6ka,"Oh wah, I have to carry around $.99 in coins. Boo hoo. I'd rather have someone lose their job. Give me a break. It's not always so simple for someone to find a new job, and why should they have to because *you* don't want to carry around 8 or 9 coins? 

It's especially sad because you had the extra dollar you're just too special to lug all that extra change around. Someone in line should have taken pity on you and given you the two cents so you didn't have your poor day completely ruined. ""heavily inconvenienced"" lmao. I really hope you are a troll and not this pathetic.

Please keep your word and don't go back, I'm sure they'll be grateful. ",t3_4u89p9
409,d5oexqz,t1_d5o28ln,That is pants-on-head stupid.,t3_4u89p9
410,d5o45an,t1_d5o3235,"Exactly. Unless the store is taking a cut of the tips, which seems unethical, the store itself doesn't lose any money. The employees working the counter are the ones who took the hit.",t3_4u89p9
411,d5nydi7,t1_d5nxqwr,"They're saying that they would lose $0.36 off of their total profits, as in all the transactions added up. Not that their profit for that one transaction would be 36¢

Edit - to clarify a little bit further, this is in the scenario in which the customer didn't have the 36¢, so the store covered it for them. So the store would be out 36¢ by essentially taking it off of their sale. ",t3_4u89p9
412,d5o3v87,t1_d5nvrld,"He said he came out to serve them again. Some slow ice cream shops are 1 man/shift operations. It would have only been ""stealing"" from himself. 


I say we give the benefit of the doubt to a seemingly good person.",t3_4u89p9
413,d5o1udf,t1_d5nuvx0,Way to rub it in. ,t3_4u89p9
414,d5nvfif,t1_d5nuzam,working on my credit issues then trying again.,t3_4u89p9
415,d5nzf4d,t1_d5nuzam,Make phones great again.,t3_4u89p9
416,d5o7vwv,t1_d5nuzam,If I had a nickle every time somebody said that,t3_4u89p9
417,d5nvf0a,t1_d5nuwyd,not one ,t3_4u89p9
418,d5nvlad,t1_d5nvbvr,its such a stupid novelty that I am so envious of. I want it because others have it...,t3_4u89p9
419,d5o9wrm,t1_d5o0aga,LG k7,t3_4u89p9
420,d5o9wcz,t1_d5o17xw,god no Lol. Im cheap not dumb.,t3_4u89p9
421,d5ntcr8,t1_d5nsr2e,And my axe,t3_4u89p9
422,d5puktm,t1_d5o80dy,[There you go](https://www.reddit.com/r/TalesFromRetail/comments/2lffbp/a_terrible_thing_to_do_for_a_customer/),t3_4u89p9
423,d5p7cd2,t1_d5o80dy,Will hunt it up when I am at home and can do it.,t3_4u89p9
424,d5nz6pk,t1_d5nwc5e,"So you're still wrong.  Fucking stop.

Edit: Downvotes, really?!",t3_4u89p9
425,d5o6u1b,t1_d5o3i5x,The lethargic man sympathizes.,t3_4u89p9
426,d5nyigw,t1_d5nue4d,We are all spotted men on this blessed day,t3_4u89p9
427,d5ny6oq,t1_d5nue4d,"Vertically challenged, thank you.",t3_4u89p9
428,d5o08ox,t1_d5nyjhs,case in point?,t3_4u89p9
429,d5nt9t3,t1_d5nt1wq,"Hey, they already paid their admission ...",t3_4u89p9
430,d5o1cyg,t1_d5nt1wq,Mr. Bones's Wild Ride?,t3_4u89p9
431,d5ohzuv,t1_d5o5gg3,It's been around since the late 70's.,t3_4u89p9
432,d5opdw6,t1_d5o5gg3,"My five year old just asked me why I was ""cackling"" after reading this. Thanks for the chuckle.",t3_4u89p9
433,d5nuj3g,t1_d5nugqp,"I've only heard of Italians using the wooden spoon. So a pissed off Italian working for the government? Now I know you're lying! (Again, just kidding). Also, this is exactly why I pay an accountant to do my taxes. ",t3_4u89p9
434,d5nv9vo,t1_d5nugqp,If you have ever had a student loan go to collections you recognize that term.  * Flashbacks intensify *,t3_4u89p9
435,d5ntfj3,t1_d5nswrf,"Yes, that is the point.",t3_4u89p9
436,d5ntnwy,t1_d5nswrf,"Sometimes some people accidentally continue to the next line while in the middle of a sentence, probably what happened to him.",t3_4u89p9
437,d5ohy0n,t1_d5oexqz,"Yeah, I think I was a dollar short.  I was like, ""Look, I can give you this $4 so you have some money for this smoothie you made.  Or you can get $0 AND throw out a perfectly good smoothie.""",t3_4u89p9
438,d5oj57p,t1_d5o45an,"I think OP is saying that if G was short $0.36 and had to cancel the sale. The ice cream shop would have thrown away the dessert and put the money back on the gift card. They would be out whatever their cost for the ice cream and toppings was.


For example, kid has $5 gift certificate and orders a $5 banana split. The cost of product is $1.00, they sell it for $5.00, but with tax it comes to $5.36. They have already made the banana split with the toppings the kid wanted. If the sale is voided they give him back the $5 gift card and are stuck with food that cost the store $1 to make, that they now have to throw away.  Better to make $3.64 in profit than lose a buck. 

Hooking up a high school kid for 36 cents is worth it for the employee as well, because if that kid didn't know he should tip before, he does now and will return with friends and tip every time. ",t3_4u89p9
439,d5o4fhc,t1_d5nydi7,She took it out of the tip jar. That money wouldn't (shouldn't) go to the company anyways. ,t3_4u89p9
440,d5o5dzc,t1_d5o3v87,Unbezzlement ,t3_4u89p9
441,d5ut4h3,t1_d5o3v87,"Every tip jar place I've worked for combines all the tips from the week, divides it by total labor hours to get an hourly rate, then pays everyone out based on their hours. That way closers don't get absolutely screwed even though their job is just as important as rush.",t3_4u89p9
442,d83vad7,t1_d5o1udf,"Was gonna rub it in, then I realised I couldnt type a cents sign either. 🙁 ",t3_4u89p9
443,d5nxsi0,t1_d5nvfif,I'm sorry your phone gives no quarter.,t3_4u89p9
444,d5obxc0,t1_d5nvf0a,1¢,t3_4u89p9
445,d5nu753,t1_d5ntcr8,"5/7 thread, gents",t3_4u89p9
446,d5puyrc,t1_d5puktm,"Hey, thanks!",t3_4u89p9
447,d5o1hl6,t1_d5nz6pk,"He's actually right so chill out. 

>It would have cost OP and the other guy $0.36. 

>It would have cost OP and the other guy $0.18 *each.* 

Notice the difference? Without ""each"" OP and other guy are considered one together, but with ""each"" they are considered separately. 

But I'm probably wasting my time since you're just going to be angry for the sake of being angry.",t3_4u89p9
448,d5nzbkt,t1_d5nz6pk,"Take a chill pill, bro. No need to get so worked up over nothing.",t3_4u89p9
449,d5o36fw,t1_d5nyigw,speak for hisself,t3_4u89p9
450,d5pakdd,t1_d5ny6oq,"> Vertically challenged, thank you.

Not a tall.",t3_4u89p9
451,d5oi8nx,t1_d5ohzuv,"As I said, newfangled.",t3_4u89p9
452,d5nv1xn,t1_d5nuj3g,"I'll make sure your name is added to the list, citizen. ",t3_4u89p9
453,d5oz69t,t1_d5oj57p,"> Better to make $3.64 in profit than lose a buck.

That's just it. The store would still make its full $4.64 profit because the store wouldn't be the one paying the difference, it's the cashier who took it out of their own tip money. So there's no reason for the business owner to be upset about the 36 cents.",t3_4u89p9
454,d83w36i,t1_d83vad7,"¢¢¢¢¢¢¢¢¢¢¢¢¢¢¢¢¢¢¢¢¢¢¢¢¢

",t3_4u89p9
455,d5oezno,t1_d5nxsi0,Dime to buy a new phone.,t3_4u89p9
456,d5nyayr,t1_d5nu753,Powered by Intel®Gent™,t3_4u89p9
457,d5o24wy,t1_d5o1hl6,"Bitch what the fuck makes you think I'm angry?

Edit: Downvotes, really?!",t3_4u89p9
458,d5nzcsz,t1_d5nzbkt,"Be right more.  No need to be so wrong over everything.

Edit: Downvotes, really?!",t3_4u89p9
459,d5o67u1,t1_d5o36fw,I be all spotted men on dis day,t3_4u89p9
460,d5pd5kj,t1_d5oz69t,Duh. I knew I was missing something on the math. Thx,t3_4u89p9
461,d5o25q9,t1_d5o24wy,Damn you're angry,t3_4u89p9
462,d5o2jg9,t1_d5nzcsz,"Internet tough guy, look out /u/LifeWulf! He's coming for you! ",t3_4u89p9
463,d5o9rxt,t1_d5o2jg9,"Apparently, he is, because now he's harassing me in other threads. 

Poor guy must have no life. Or hasn't hit puberty yet. I almost feel sorry for him. ",t3_4u89p9
