,comment_id,comment_parent_id,comment_body,comment_link_id
151,d5nshcp,t3_4u89p9,My faith in humanity has been temporarily restored! LOL,t3_4u89p9
152,d5nqic2,t3_4u89p9,[Something similar happened to me](https://www.reddit.com/r/TalesFromThePizzaGuy/comments/3wyvn9/last_week_i_paid_for_the_pizza_for_a_family_that/),t3_4u89p9
153,d5ofmud,t3_4u89p9,If you were an overweight bald guy this would have never happened,t3_4u89p9
154,d5np15u,t3_4u89p9,"Conversely, my mother was once pennies short of the price for a drive-through fast food order, and the cashier would not budge on the matter. So she opened the car door and started trying to find pennies to pick up off the road in front of the window, since it was all she could do. The cashier just stood and waited. ***shrug***",t3_4u89p9
155,d5nqnul,t3_4u89p9,No it did not happen,t3_4u89p9
156,d5nsuss,t3_4u89p9,are you a decent lookin female by any chance? would explain that.,t3_4u89p9
157,d5nmum1,t1_d5nmkox,"I was definitely expecting this to be one of those stories with the crazy mom buying ice cream for her kid, and she is 36¢ short and tries to get away with leaving because ""It's just 36¢"".",t3_4u89p9
158,d5npeev,t1_d5nmkox,I was expecting him to get yelled by his boss using some explanation saying that if he gave every customer 36 cents that's 100 dollars or something ridiculous ,t3_4u89p9
159,d5nsjrm,t1_d5nmkox,"I'm a lil drunk, but made me almost tear up a bit.",t3_4u89p9
160,d5nq5vd,t1_d5nmkox,[deleted],t3_4u89p9
161,d5nvtz2,t1_d5nmkox,http://i2.kym-cdn.com/photos/images/facebook/000/380/373/03a.jpg,t3_4u89p9
162,d5o3yji,t1_d5nmkox,Great shot kid! That was one in a million!,t3_4u89p9
163,d5nvvby,t1_d5nmkox,Yeah. Really nice to see something like this at the top of all for once.,t3_4u89p9
164,d5ntskp,t1_d5nmkox,"Perfect top comment, summing up the thought process of every reader here.",t3_4u89p9
165,d5nyd4a,t1_d5nmkox,"Yep, was expecting a disciplinary and dismissal",t3_4u89p9
166,d5nz9sc,t1_d5nmkox,"Near the end, I thought the kid came back to buy some ice-cream and tried to buy it all with money from the tip jar.",t3_4u89p9
167,d5o4wn9,t1_d5nmkox,"Yeah me either, had a friend who did something similar once and it turned out the customer was a secret shopper and he got fired.",t3_4u89p9
168,d5nvk8l,t1_d5nmkox,"Fiscally irresponsible, but nice nonetheless.",t3_4u89p9
169,d5no7ef,t1_d5nny6k,"i spotted a customer a penny after he went out to his car to come back with exact change,and was short. he kept telling me no. he took 5 minutes, then came back with a penny.

thanks mr. ",t3_4u89p9
170,d5no4kv,t1_d5nny6k,[deleted],t3_4u89p9
171,d5npjlf,t1_d5nny6k,"Yeah, well, about that: You only whipped out a quarter. Twenty-five measly cents. *Thirty-six cents*, on the other hand, is worth a ticker-tape parade. I mean... it's *thirty-six cents*!!! ",t3_4u89p9
172,d5nq369,t1_d5nny6k,You were 11 cents short of your pay out. ,t3_4u89p9
173,d5npefy,t1_d5nny6k,"Yes, but you felt good. Isn't that its own reward?

^^^^^^^^^^^^^jksorryforyour$20loss",t3_4u89p9
174,d5nw1jj,t1_d5nny6k,"This happened to me today I gave some lady in front of me a dollar because she was short and digging in her purse and kept coming up empty, the lady didn't even say thanks. I almost took my dollar back just on principle but I was sick of standing in line and it was just a buck.  People are fucking rude, it's nice to hear good stories",t3_4u89p9
175,d5nr1hh,t1_d5nny6k,You got shafted. I got a handwritten letter and 5 bucks when I did it.,t3_4u89p9
176,d5nv5un,t1_d5nny6k,I've done that a few times myself. I don't mind doing it. ,t3_4u89p9
177,d5nwna6,t1_d5nny6k,I thought most retail places forbid you from having your own wallet+money on your persons whilst working?,t3_4u89p9
178,d5omh8s,t1_d5nny6k,"I returned a little, old lady's purse once and she left me a $5 tip.

Later I returned what turned out to be one of the store owner's massive money clip and got nothing, not even a thank you.",t3_4u89p9
179,d9ghfk4,t1_d5nny6k,"I had a guy give me a dollar once so I could pay in exact change. He wasn't even in line or anything, literally had just entered the gas station. It was a good day.",t3_4u89p9
180,d5nsrzu,t1_d5nny6k,"When this happened to me, when a clerk took a quarter out of their own wallet I just felt weird and awkward and embarrassed and wanted to get out of there and never come back. I did say thank you though, many times.",t3_4u89p9
181,d5nr0zs,t1_d5nny6k,Tell me why the fuck you think it's ok to keep coins in your wallet,t3_4u89p9
182,d5nr5yb,t1_d5nny6k,"I had someone ask me where the nearest ATM was, saw them go to it, then immediately come back and give me a $20.  Was sweet. ",t3_4u89p9
183,d5nod0a,t1_d5nm38s,Then you might be on the wrong sub,t3_4u89p9
184,d5ntmpk,t1_d5nm38s,Yeah. Most of the ones I see that hit the front page are nightmare stories.,t3_4u89p9
185,d5nuuzu,t1_d5nn9wz,i would bet its the kids parent that gave him the 20 and told him to put it in the tip jar,t3_4u89p9
186,d5ns1yb,t1_d5no8qj,.,t3_4u89p9
187,d5nrjn0,t1_d5npx35,"Wow, that's insane to me. Would never happen in the US unless you find the right mom and pop joint. That would make me a repeat customer though so maybe he knows what he's doing. ",t3_4u89p9
188,d5ny0tc,t1_d5npx35,"Had a similar story happen to me, I frequent a particular barber in town, run by this amazingly nice Middle Eastern man and his wife. Went to pay for my haircut and I had lost my card and had no cash on me. I tell the guy I'm incredibly sorry and I could run to my bank across the street to get a new card and grab some cash. He said not to worry and to just stop by tomorrow or whenever I get my next cut.

Stopped by the next day and gave him a juicy tip along with it. The guys cuts are amazing, he deserves it.",t3_4u89p9
189,d5o5fhm,t1_d5npx35,You must have an air of honesty about you. I'm sure that trust isn't extended to everyone.,t3_4u89p9
190,d5q3a40,t1_d5npx35,"I read this  message and got excited because i m going to copenhagen for work this week and am looking for a good burger ,tried to go there earlier today but he's closed because he's on holidays !
",t3_4u89p9
191,da3um0x,t1_d5npx35,I had this happen because cc machine was out gave me a free sandwich on a monday and I said I would pay for 2 when I came next time(went there a lot). Business was closed for good on friday when I went to pay for it and buy another. Free sandwich yey?,t3_4u89p9
192,d5nyys7,t1_d5npx35,r/HumbleBrag,t3_4u89p9
193,d5nu71f,t1_d5nrb3y,">I told my manager and she wasn't happy, told me that if he doesn't come back then I have to pay for it

Fuck her.  ",t3_4u89p9
194,d5nr2wu,t1_d5nor89,"I think this goes for all interactions. Just be good to people. 

My career often puts me into VERY adversarial (by nature) interactions with the public, but being kind and honest with people is usually enough to get the job done with a minimum of fuss. Respect people, respect their rights, respect their choices, and be decent. The little things matter. Something as simple as *please and thank you* matter.",t3_4u89p9
195,d5nsuz6,t1_d5nor89,"Couldn't agree more. I have no issue helping a nice customer. The rude ones, I'll do what I have to but no more.",t3_4u89p9
196,d5nre0q,t1_d5nor89,"I work in car rental and I have a huge amount of control over what I can charge people and just how much I can help them out (change daily or weekly rates, waive underage driving fee, waive additional driver fee, start charges late, backtrack hours so they pay less, help them out on fuel, one way fees, etc). 

What I'm willing to do depends almost exclusively on the customer. If you're demanding or condescending I won't lift a finger to help you out. If you're nice, polite, and don't expect me to just blindly help you out; I usually will. ",t3_4u89p9
197,d5nsu5o,t1_d5nor89,Who keeps more than like 2 bucks in quarters in their car?,t3_4u89p9
198,d5o0ug2,t1_d5nor89,Upvoted for the username alone,t3_4u89p9
199,d5nr3i6,t1_d5nn4ye,"They were 36¢ short, you won't believe what they did with the tip jar!!!",t3_4u89p9
200,d5nvr0k,t1_d5nn4ye,"Haha! The first time I read the story, I read it as him sticking his hand in the tip jar as well.",t3_4u89p9
201,d5nqkwu,t1_d5nn4ye,I think you read a different story than I did,t3_4u89p9
202,d5nvlh6,t1_d5npijb,Chilly Rock Creamery is the best!,t3_4u89p9
203,d5o1ry0,t1_d5npijb,On the real this is this marble slab or cold stone?!?!,t3_4u89p9
204,d5nyjfu,t1_d5npijb,"In case anyone was wondering, the place that OP worked at was Cold Stone Creamery. ",t3_4u89p9
205,d5oje50,t1_d5nvuu7,"Can confirm, I worked at Coldstone for about 9 months. Really fun awesome job. If we were tipped a dollar, we would ask if they wanted a song. We always did songs that were popular, but with Coldstone related words. 

Songs such as the Flinstones theme, Over the Boardwalk, La Cucaracha, The Adams family theme.

To avoid the singing, just say ""No song needed""",t3_4u89p9
206,d5o1091,t1_d5nwlcc,"Interesting fact: unsubscribed spelt backwards is debircsbusnu, which is a word i've never heard before.",t3_4u89p9
207,d5ns5pb,t1_d5nrfmj,"I just read it, not sure why you can't see it but here it is.

> So I used to work at an ice cream chain where we prepared the ice cream with various toppings on a frozen piece of rock.
> 
> 
> On this particular day, I was working with one other person and it wasn't too busy. Two young guys came in, about high school age. They ordered a large bowl of ice cream with a few toppings, I mixed it for them and went to ring them up. I'll use use G for guy, since I really just talked to one of them.
> 
> 
> Me: Okay, so that'll be $x.xx
> 
> G: Okay, I have a giftcard.
> 
> Me: Great! *scans card* so it looks like you owe another $0.36 after the giftcard.
> 
> 
> At the point, they both look at each other and shrug sadly.
> 
> 
> G: Oh...I'm sorry, I don't have any money with me, never mind....
> 
> Me: Oh hey, it's cool, only $0.36 *I take the $0.36 out of the tip jar and put it in the till* no big deal!
> 
> G: Wow, thanks!
> 
> 
> The two guys leave, and I thought that was that. Felt good doing something nice.
> 
> 
> So the one guy comes back several hours later. I saw him come in, and went to the register to meet him.
> 
> 
> Me: Oh hey! You're back. Did you need anything el...
> 
> 
> Before I finished, and without looking at me once or saying a word, he dropped a $20 bill in the jar and immediately turned and left.
> 
> 
> I was so shocked I just stared after him until he walked out the door.
> 
> 
> So that was pretty cool :)",t3_4u89p9
208,d5nsolz,t1_d5nrfmj,"Weird, its not giving me an indication its been removed or anything",t3_4u89p9
209,d5ns31m,t1_d5nrfmj,[deleted],t3_4u89p9
210,d5nuf8j,t1_d5nrfmj,It's not removed,t3_4u89p9
211,d5novxm,t1_d5nonma,"yeah, or else the love you bring wont mean a thing, or so Ive heard",t3_4u89p9
212,d5ntlpf,t1_d5nsoau,"I expected the two guys to come back, clock her in the head with a tire iron, and steal some money",t3_4u89p9
213,d5nwxbj,t1_d5nut8q,Cold Stone is another one,t3_4u89p9
214,d5nr8xc,t1_d5nqg3c,[deleted],t3_4u89p9
215,d5nrgh7,t1_d5nqg3c,[removed],t3_4u89p9
216,d5nr9v1,t1_d5nqg3c,"What is it?  Sorry if it's obvious, but I tried googling it and found nothing. 

Do they really serve it on a rock? ",t3_4u89p9
217,d5ny3lk,t1_d5nvs9g,/r/humblebrag ,t3_4u89p9
218,d5nz8k8,t1_d5nvs9g,"r/HumbleBrag

",t3_4u89p9
219,d5nqebw,t1_d5nqdhy,Or his parents gave him the money to do it after he told them the story,t3_4u89p9
220,d5oppn6,t1_d5oja1p,http://imgur.com/gallery/ohYY5,t3_4u89p9
221,d7av0p1,t1_d6u9tg5,Then we're does he work then?,t3_4u89p9
222,d5o7bd6,t1_d5nvnfv,"r/nothingeverhappens

Seriously, do you guys think karma is actually *worth* something?",t3_4u89p9
223,d5nupzl,t1_d5nuie3,"Having no such disillusion would mean you do have such an illusion :)

",t3_4u89p9
224,d5o8hl7,t1_d5nvf8d,Have you never heard of Cold Stone?,t3_4u89p9
225,d5ofe32,t1_d5o16o0,cold.....stone... :P,t3_4u89p9
226,d5ofdfd,t1_d5ocldc,cold....stone...got it yet?,t3_4u89p9
227,d5opz9i,t1_d5oeal7,"That name seems like a name that should be on a list like... uhhh...""names not to give your kid unless you fully intend to teach them the golden rule""... or something? IDK",t3_4u89p9
228,d5nxmhb,t1_d5nw5k1,I have worked at places where you would get written up if your drawer was .02 off.,t3_4u89p9
229,d5ny1x3,t1_d5nw5k1,because people do in fact get in trouble for that?,t3_4u89p9
230,d5nqoss,t1_d5nqic2,here we have your typical one upper no one likes,t3_4u89p9
231,d5nqi75,t1_d5np15u,"It's not really the cashier's job to help your mother shortchange the business-- actually, that is the exact opposite of the cashier's job.

If the cashier wanted to cover the difference out of her own pocket, it would be her prerogative.  But it shouldn't be expected.

If your mother chose to account for the shortfall by scrounging around the floor for pennies, that is your mother's decision.  It doesn't change the situation for the cashier at all.",t3_4u89p9
232,d5ntizh,t1_d5nqnul,And then everybody gave them a standing ovation. ,t3_4u89p9
233,d5notbv,t1_d5nmum1,"I was expecting ""oh, well it didn't matter last time...""",t3_4u89p9
234,d5nr2za,t1_d5nmum1,Exactly what I was thinking when I saw the title.,t3_4u89p9
235,d5nr5js,t1_d5nmum1,"When it got to the point where he came back, I expected it to be a secret shopper and the employee getting fired for stealing money from the tip jar, shared by all of the employees...",t3_4u89p9
236,d5o0rnq,t1_d5nmum1,I was him expecting to come back and try to get a refund because the ice cream was bad or something and demand to get the full money back and then when OP mentions the 36 cents he refuses to give that back to the tip jar. The shopper then causes a scene which brings in the manager. Then the manager finds out OP took 36 cents from the tip jar and fires them.,t3_4u89p9
237,d5nu4x9,t1_d5nmum1,how do you make the cents sign?,t3_4u89p9
238,d5nwrmz,t1_d5nmum1,Thought he was gonna come in and take money out of the tip jar lol,t3_4u89p9
239,d5nwxcc,t1_d5nmum1,I don't think that would reach the front page nowadays.,t3_4u89p9
240,d5o2wxl,t1_d5nmum1,In fairness at every retail cashier job i have ever worked id have let it go. ,t3_4u89p9
241,d5occ6c,t1_d5nmum1,I thought the kid was going to come back and rat on OP or something and get them in trouble. ,t3_4u89p9
242,d5nqeiu,t1_d5nmum1,I was expecting the punchline to be three-fifty.,t3_4u89p9
243,d5nwbu6,t1_d5nmum1,"I had someone not want to buy an entire cart full of perishable items over $2. I took the $2 off for her, and said: ""Normally we don't do this, but I don't want to have to throw away all this milk"". ",t3_4u89p9
244,d5npszg,t1_d5npeev,"Totally had that happen. My replacement manager I was training since I was going on maternity leave. My god, you think I'd stolen from the till and not just gone and fetched a dollar from my own wallet. Lady came back 20 minutes later with the dollar to repay and hot drinks for everyone. Needless to say I did not recommend that woman for hire. ",t3_4u89p9
245,d5npzwg,t1_d5npeev,O.P. took it out of the tip jar so it cost OP 36 cents. It didn't cost the owner anything. ,t3_4u89p9
246,d5nucwr,t1_d5npeev,"You know, as a customer I find it really hard to praise employees for exceptional customer service (even though I really want to) because I'm convinced management will reprimand or fire them for not following protocol or something similarly ridiculous, so I just never do it.",t3_4u89p9
247,d5nuwcf,t1_d5nsjrm,I'm guessing you're the emotional type of drunk. ,t3_4u89p9
248,d5ntqlo,t1_d5nq5vd,That's the obvious outcome,t3_4u89p9
249,d5nvydo,t1_d5nvvby,So shines a good deed in a weary world.,t3_4u89p9
250,d5nqcat,t1_d5no7ef,I don't see how his height is relevant to the story.,t3_4u89p9
251,d5nqtdc,t1_d5no4kv,"""The joyfulness of poorness is in the great richness of giving and feeling happy"" ~~ Amália Rodrigues (technically Reinaldo Ferreira, but no one knows him)",t3_4u89p9
252,d5nsivu,t1_d5no4kv,Yeah I didn't mind doing it. It's only a quarter. Can't afford to be spotting full bills though!,t3_4u89p9
253,d5nr0sq,t1_d5no4kv,He's joking...,t3_4u89p9
254,d5oiktx,t1_d5npjlf,I spotted a customer $.50 today so she could get a drink. The 50 cents had been for me to get a drink. What do I get?,t3_4u89p9
255,d5oimae,t1_d5nwna6,"It's definitely best practice, keep your money away from retail store money, but I've learned not every place mandates it. ",t3_4u89p9
256,d5ns1tq,t1_d5nr0zs,Because it has a little pocket for them.,t3_4u89p9
257,d5ntfui,t1_d5nr0zs,I tried storing them in my cheeks like a hamster but people kept looking at me weird. ,t3_4u89p9
258,d5nol39,t1_d5nod0a,"Maybe we could make some meta tags for heartwarming vs ""I hate humanity"" type stories?",t3_4u89p9
259,d5novde,t1_d5nod0a,"Without the stories of crazy, fucked up weirdos, these stories wouldn't feel as uplifting.",t3_4u89p9
260,d5nv3tr,t1_d5nuuzu,"Even if it was his parents, he now has an example of decency in his mind. He has a better chance at growing up to be conscientious. Lead by example, ya know? ",t3_4u89p9
261,d5nvn42,t1_d5nuuzu,"Yeah probably. But hey, she's raising a good kid so =P",t3_4u89p9
262,d5ntmff,t1_d5ns1yb,Kindness breeds kindness.,t3_4u89p9
263,d5nz3t5,t1_d5ns1yb,"Nah man, give your money to me and I promise God will repay you 100x over.",t3_4u89p9
264,d5nyo7j,t1_d5ns1yb,"The place where I work, we think of it in the long run. 

Customer is upset, you foot their $100 bill, and call it a day. They leave satisfied knowing that they didn't have to pay for their food that was poorly cooked or something went wrong. They also feel that they were not cheated, and they come back again and again, hopefully. You have now earned this lifetime customer who may come in for the next 20 years, and paying an average of $100 check every two weeks or once a month. $100 may look like a lot for one customer at that moment, but when you look at into the future, you are losing a lot more if you didn't do something at that moment.",t3_4u89p9
265,d5nsmj4,t1_d5nrjn0,"Similar thing happened to me in London, went to the same stand every day for breakfast and a drink and one day my card got declined. Told me just to pay for it tomorrow. He wouldn't let me tip him the next day, but he did let me buy him a chocolate bar :)",t3_4u89p9
266,d5o02lp,t1_d5nrjn0,"Recently I was on vacation, and I passed through Boulder Colorado. I stopped at a brewery for lunch. For some reason, they only took cash, but if you didn't have cash they would give you an envelope to mail in the cash once you got some. I think it was called mountain sun brewery.",t3_4u89p9
267,d5nyhiu,t1_d5nrjn0,Sounds like a Mom and Pop joint in Copenhagen. Wouldn't happen in a chain there either. ,t3_4u89p9
268,d5o36tj,t1_d5nyys7,"Reddit, you never fail to disappoint. Just can't ever let something decent go by without sniping at it. ",t3_4u89p9
269,d5o0hrx,t1_d5nyys7,Sorry if it came off that way. I could have left out that I gave him a tip but it fit the narrative of what OP posted. Just wrote this for the sole purpose of showing how much of a bro he was. Never had that happen to me before ,t3_4u89p9
270,d5nvogo,t1_d5nu71f,Why? What else was she supposed to do?,t3_4u89p9
271,d5nrdkc,t1_d5nr2wu,Police officer? Debt collector? Tow Truck?,t3_4u89p9
272,d5nt6aw,t1_d5nsu5o,The lady that just payed me 5 bucks in quarters in the drive through,t3_4u89p9
273,d5nwwdw,t1_d5nr3i6,[deleted],t3_4u89p9
274,d5nshle,t1_d5nqkwu,I guess he thought the customer reached into the tip jar.,t3_4u89p9
275,d5nxrcj,t1_d5nvlh6,When I was in high school a place opened up in town called Frosted Slab... It was okay. ,t3_4u89p9
276,d5o48q1,t1_d5nyjfu,Could be. The customer ran out after tipping because he didn't want to hear $20 worth of songs,t3_4u89p9
277,d5nzeef,t1_d5nyjfu,Could be Marble Slab.,t3_4u89p9
278,d5nt3sh,t1_d5nsolz,[deleted],t3_4u89p9
279,d5nxyk7,t1_d5nwxbj,"Ah, forgot those were around. None really in my area.",t3_4u89p9
280,d5nsobl,t1_d5nr8xc,Mine was replaced with a tobacco store :(,t3_4u89p9
281,d5nrk2r,t1_d5nrgh7,[deleted],t3_4u89p9
282,d5nrck3,t1_d5nr9v1,[removed],t3_4u89p9
283,d5nqo03,t1_d5nqebw,"yeah... there's like a 90% chance that's what really happened, but hey let's just pretend ",t3_4u89p9
284,d5obnec,t1_d5o8hl7,Ya? That's why it's funny...,t3_4u89p9
285,d5ofkaw,t1_d5ofdfd,God damn it.  That went over my head like a god damn airplane.,t3_4u89p9
286,d5o81kl,t1_d5nxmhb,"Why? Seriously asking.

I mean, if it's just petty bureaucracy then why work there?

They'd fire you for losing 10 cents a month? You can find that on the sidewalk.",t3_4u89p9
287,d5nvc2k,t1_d5nqi75,So the whole operation should come to a stop while she looks for a few pennies and create negative experiences for all parties involved?  That's a greater loss than a few cents.,t3_4u89p9
288,d5ntnve,t1_d5notbv,Was expecting insane manager to fire competent staff over 36¢,t3_4u89p9
289,d5nsu0m,t1_d5notbv,"""I'm $20 short, can you take it out of the tip jar? Well you did it last time! So what if it's $20 now and not ¢36? I want to speak to your manager!"" ",t3_4u89p9
290,d5nxntt,t1_d5notbv,Or *Well the other person let me do it.*,t3_4u89p9
291,d5ny8u8,t1_d5notbv,"""The owner lets me do it all the time.""",t3_4u89p9
292,d5nud0l,t1_d5nu4x9,"Well, I'm on mobile and my keyboard allows me to tap and hold on the dollar sign and it gives me other options. ",t3_4u89p9
293,d5nupp8,t1_d5nu4x9,On keyboard it's alt+0162 on numpad,t3_4u89p9
294,d5nvlwg,t1_d5nu4x9,"Alt Gr button + c
(If you have that button)",t3_4u89p9
295,d5nr4pd,t1_d5nqeiu,Probably downvoted because you spelled fiddy wrong.,t3_4u89p9
296,d5of10b,t1_d5nwbu6,Why would you have to throw it away?,t3_4u89p9
297,d5nv0c4,t1_d5npszg,"Wait, so you were training her and she had the gall to lecture you? Over your own dollar? What a nut.",t3_4u89p9
298,d5nwikp,t1_d5npszg,Haha I think you've shared this story before. I remember reading it in more detail before. ,t3_4u89p9
299,d5nqrch,t1_d5npzwg,"It could have cost OP *and* the other guy working ~~36¢~~ *$0.18 each for the nitpicky*, if they pool the tips and distribute them later like the place I worked at did. But either way it's a small amount, not really worth getting worked up over.",t3_4u89p9
300,d5nvejp,t1_d5nucwr,[deleted],t3_4u89p9
301,d5nvcnw,t1_d5nuwcf,"Yeah. Both ways. But mostly the crying one. Especially to romantic and happy ending movies. I am a 120kg/264lbs, 184cm/6ft bundle of manly fur mind you. :D",t3_4u89p9
302,d5nsksg,t1_d5nqcat,well he said he spotted the man. maybe it was unusual due to his shortness,t3_4u89p9
303,d5nqik4,t1_d5nqcat,"Shush dad, I'm listening to the nice mans story",t3_4u89p9
304,d5ofwtw,t1_d5nqcat,(poorly thought-out pun relating lbs and £),t3_4u89p9
305,d5nsfgd,t1_d5nqtdc,"> technically Reinaldo Ferreira, but no one knows him

It's okay, i don't know that first guy either.",t3_4u89p9
306,daka9u0,t1_d5oiktx,Did you spot him 36¢? Exactly. You get nothing.,t3_4u89p9
307,d5nzuwu,t1_d5ns1tq,"Exactly. I actually get my wallets from Europe (I have family over there so they send one over every other year or so for christmas). Since the 1 euro is a coin, most Euro countries make it a lot easier to find wallets with a built in coin pouch. (Seriously, they're nearly impossible to find over here.)

It's not like I'm keeping $7.32 in random coins in there. Usually it's  spare change from the day and maybe $1-2 in quarters for random stuff that might need them. I find it way easier than having random coins in my pocket or a whole SECOND WALLET FOR COINS. (my dad does this and it drives me nuts)",t3_4u89p9
308,d5npb4d,t1_d5nol39,"I think that tags would spoil an unexpected heartwarming ending though and not have the same effect. But that's just my opinion, it is a good idea :)",t3_4u89p9
309,d5npvfo,t1_d5nol39,"But assign them randomly, of course.",t3_4u89p9
310,d5oikoj,t1_d5novde,You forget that we have our lives also.,t3_4u89p9
311,d5nyrpn,t1_d5nv3tr,The apple does not fall far from the tree. Parents are the foremost example that kids have on how to act.,t3_4u89p9
312,d5nvvlo,t1_d5ntmff,kind fuckers,t3_4u89p9
313,d5o06ql,t1_d5o02lp,"That's pretty weird. It's inexpensive as hell to get a credit card scanner, but maybe they don't like the minimal fees to the credit card companies? Either way seems like you'd certainly lose out on money with this method and the backend work just to make sure people sent money in is already too much hassle. I mean there are food trucks in my area with credit card scanners. ",t3_4u89p9
314,d5nw6m7,t1_d5nvogo,"I think it may be illegal to make the employee pay, based on what I read on legal advice... But I'm not a lawyer, so who knows ",t3_4u89p9
315,d5nwfsp,t1_d5nvogo,Accept the potential loss and not punish someone for something not under their control?,t3_4u89p9
316,d5nrjsf,t1_d5nrdkc,"Formerly a revenue agent with the IRS. This would be an ""auditor"" but one that does so face to face, or at least often on premise.",t3_4u89p9
317,d5nxvkl,t1_d5nwwdw,Mr Baity is a real ... master of the genre...,t3_4u89p9
318,d5nsr54,t1_d5nshle,[deleted],t3_4u89p9
319,d5nuq65,t1_d5nt3sh,It happens when a mod removes it but it can be reinstated. ,t3_4u89p9
320,d5nrlcs,t1_d5nrk2r,"Hm, I've eaten there but never had the ice cream like that I guess. What happens when it melts? Just oozes off the side of the rock?",t3_4u89p9
321,d5nrjz7,t1_d5nrck3,Could be Marble Slab,t3_4u89p9
322,d5nrwys,t1_d5nrck3,"Ah okay,  thanks. ",t3_4u89p9
323,d5nr9d1,t1_d5nqo03,"He could have pocketed the money and never went back. Either way,  good on the kid. ",t3_4u89p9
324,d5obss9,t1_d5obnec,Oh! Is that what that meant?,t3_4u89p9
325,d5ofsf5,t1_d5ofkaw,"They actually do use a large flat stone to mix their ice cream, though... :P",t3_4u89p9
326,d5odkrn,t1_d5o81kl,I dont know why. It was a fast food job. They got riled up by a lot of things.,t3_4u89p9
