,comment_id,comment_parent_id,comment_body,comment_link_id
0,d5nmkox,t3_4u89p9,Not at all where I thought this was going. Nice kid!,t3_4u89p9
1,d5nny6k,t3_4u89p9,I  took a quarter out of my own wallet to spot a customer once and they didn't come back and give me a $20. I feel cheated.,t3_4u89p9
2,d5nm38s,t3_4u89p9,These are the stories I love to read on this sub,t3_4u89p9
3,d5nn9wz,t3_4u89p9,"What a kind young man. I mean $0.36 is nothing. I've done things like said don't worry about it. I went to buy something the other day and I had small change, I was counting it first I didn't know if I had enough and the woman said to just get as close as I could. As it was I had enough but she was just so nice about it. But for him to come back and do that. It goes to show how much of a difference you made to his day. This is just the sweet kind of story I like to see at this time in the morning.",t3_4u89p9
4,d5no8qj,t3_4u89p9,Same has happened to me. A woman was 10¢ short so I said it was fine and that I'd just cover it with my tips since it was on a dime. She came back an hour later and gave me a $10 tip.,t3_4u89p9
5,d5npx35,t3_4u89p9,"Similar situation happened with me but vice versa. There's a burger place in Copenhagen called Banana Joe's (little shop but very popular and juicy burgers) and inside there is the large, friendly owner who works there almost every day. I'm on my way to my friends so I order 3 Cheese&Bacons + fries to go. I wait 5 minutes or so and he hands me the bag and I ask him if it's ok that I pay by card (in Copenhagen a lot of stuff is done through cards/mobile pay) but he says I cannot and I offer to quickly pop to the ATM and withdraw money (not that far away). He stops me and says ""No no. I want you to enjoy these burgers fresh and warm, stop by tomorrow and pay."" 

So there I am somewhat starstruck with what he's saying and ask him if he's sure. He says yes and to enjoy my evening. The next day I take the bus back to his and pay him an extra 10 dollars, he almost refused that too but I insisted. I just hope that other uni students like myself have shown him the same courtesy and not shade the guy.",t3_4u89p9
6,d5nrb3y,t3_4u89p9,[deleted],t3_4u89p9
7,d5nor89,t3_4u89p9,"I wish customers realized that if you act like a decent human being, the employees will treat you well. Like at the store I worked in, if you showed your membership card for the shopping center, you'd get a percentage off if your total was over a certain amount. We didn't have to physically collect anything or swipe anything, so it was totally untracked. On one occasion, a customer had a $110 purchase with a ton of little things, but she was a couple bucks short on cash. She apologized profusely and asked if I could put her purchase on hold so she could run out to her car and get some more cash, apologizing the whole time. I didn't feel like going through the effort it would take to hold this transaction and didn't want to make her run to the car, so I just entered the coupon and said ""ok you have enough cash now.""

On the other hand, I once had a customer who was a few bucks short and he said really belligerently ""I don't feel like going to my car, help me out man. Is there anything you can do?"" ""Nope."" ""Dude, what's your problem?"" ""You don't have cash.""",t3_4u89p9
8,d5nn4ye,t3_4u89p9,"Totally read the ""oh I'm sorry"" then saw the reaching into the tip jar"" and was like ugh some people... But then...",t3_4u89p9
9,d5noo79,t3_4u89p9,I once gave a small kid €0.50 because I didn't want to wait for him to change his order to something cheaper. I helped him for my own selfish reasons and he probably told his parents and came back with €1 for me. I was prepared to pay a little extra to speed up my order and it ended up costing me less.,t3_4u89p9
10,d5nn793,t3_4u89p9,Nice to hear something good happening for once. ,t3_4u89p9
11,d5npijb,t3_4u89p9,">frozen piece of rock

Oh man, I love Granite Chunk Creamery.",t3_4u89p9
12,d5nn6ot,t3_4u89p9,"Maybe at another time someone was rude to him about something similar, and he really appreciated you not making a scene about it. ",t3_4u89p9
13,d5ntzj9,t3_4u89p9,"I had just moved to a new city, and I walked into one of the local hardware stores to buy a keyring for my new apartment keys. Old school place, very small. Just a couple of old dudes with bushy white mustaches in the back, the whole shop floor covered in sawdust. 

I find the size I want, and the guy tells me it's $0.25. I pull out my credit card (cause I'm a millenial, and I don't carry cash. Fuck me right?) He explains that they can't handle credit cards. He tells me to just take it. It's only 25 cents.

I thank him and walk back to my car where I remember I had my laundry money in the back seat. I grab 50 cents and run back to the store. I paid him 50 cents because I felt that his charity needed to be rewarded.

It's not as much as the kid from your story, but I felt a whole lot better knowing that I was able to, in some small way, reward a charitable deed.",t3_4u89p9
14,d5nyvjb,t3_4u89p9,"I was the guy in a similar experience once. Went to a Puscifer show in manhattan, ordered a double whiskey on the rocks... $25.

what. 

so i hand him my card, he tells me they don't take cards...

i have $24 cash on me, super bummed, he says no worries, i'll take care of it!

i went back to my seat, enjoyed my drink, and when i went to the bathroom i found out the theatre allowed readmittance, so i just walked to an ATM, took out cash, went back to that guy's line, waited behind two people, and handed him $20 with a thank you and went back to my seat. 

he actually gave me some free food at the near the end of the show also, when i went back for a snack. ",t3_4u89p9
15,d5nvuu7,t3_4u89p9,Ok so I don't know if it's nationwide store policy but the cold stone where I'm from makes their employees sing this godawful song when you leave a tip for them and so I'm very conflicted about tipping.  I'm not trying to make them perform for my amusement but I also don't want be a cheap jerk who doesn't tip.  Is there like a code I can use when tipping so they know they don't have to sing the song?,t3_4u89p9
16,d5nteui,t3_4u89p9,I came here for a riot goddammit ,t3_4u89p9
17,d5nwlcc,t3_4u89p9,[deleted],t3_4u89p9
18,d5nxsca,t3_4u89p9,"happened the other day, guy was short 50 cents in cash and was going to use his card, so I just took it out of the tip jar and the next time he came back he dropped $4 in the jar. not as big but still nice",t3_4u89p9
19,d5nxtd6,t3_4u89p9,You deserve that $20.,t3_4u89p9
20,d5nrfmj,t3_4u89p9,[deleted],t3_4u89p9
21,d5ol5z2,t3_4u89p9,"I went through an In-N-Out drive thru near the Las Vegas Strip with only my American Express card on me. Guess what card they didn't take? I was so embarrassed but the manager didn't hesitate and absolutely insisted on giving me the food anyway. I went back to my hotel, gobbled my food, and rushed back to pay. She was actually really surprised and said most people don't come back. Wow. I asked, why did you give it me, then? And she said ""I will never give up my faith in humanity, thanks to people like you.""

That happened 7 years ago. I haven't given up on humanity either because of that incident. I used to be so damned pessimistic about humanity. I hated everyone. Amazing how such a small act as 'not having the right form of payment' can end up changing one's entire life. It really makes me wonder where I'd be today if I'd just had a $10 in my pocket, you know? Probably still an unhappy recluse...",t3_4u89p9
22,d5nonma,t3_4u89p9,"Did you sing?  In my experience with the frozen piece of rock establishment, tips usually result in singing.  ",t3_4u89p9
23,d5nsoau,t3_4u89p9,Man that was unexpected. I was expecting the two guys coming in week after week with the same schtick our something,t3_4u89p9
24,d5nut8q,t3_4u89p9,"""Frozen piece of rock""
Marble Slab Creamery?",t3_4u89p9
25,d5nvuxs,t3_4u89p9,Bummer that we are all so conditioned to assume this could have only been headed in a bad direction. Nice to see a rare example of an unbridled act like this being shared!,t3_4u89p9
26,d5o567p,t3_4u89p9,This became 3rd most upvoted post overall on r/TalesFromRetail in only nine hours.,t3_4u89p9
27,d5ogp15,t3_4u89p9,"On the other hand, one of my customers was short the other day so they just helped themselves to my tip jar without asking.  WTF.",t3_4u89p9
28,d5nqg3c,t3_4u89p9,[removed],t3_4u89p9
29,d5noinb,t3_4u89p9,Awwwwwww :),t3_4u89p9
30,d5nonso,t3_4u89p9,"If only all retail customers were this generous, or at least this thoughtful.",t3_4u89p9
31,d5nssp3,t3_4u89p9,Here I was all prepared to have my jimmies rustled.,t3_4u89p9
32,d5nten9,t3_4u89p9,For some reason The title led me to believe this would be about a terrible wage equality argument,t3_4u89p9
33,d5nxl4y,t3_4u89p9,$19.64 profit. Nice,t3_4u89p9
34,d5nyvtm,t3_4u89p9,/r/astrangermademesmile ,t3_4u89p9
35,d5nzamo,t3_4u89p9,Did you sing that stupid song?,t3_4u89p9
36,d5o0nt6,t3_4u89p9,I used to do this for a lot of my customers at Insomnia Cookies. In return they'd come in as frequent customers and I'd always get a $5 tip from them.,t3_4u89p9
37,d5o0zmn,t3_4u89p9,"Finally, a story that doesn't make me hate society!",t3_4u89p9
38,d5o2d0q,t3_4u89p9,There should be more stories like this.,t3_4u89p9
39,d5o4mbo,t3_4u89p9,"I love stories like this. Last month a regular customer of mine forgot her wallet. We told her not to worry at all and covered her meal with our own food allotment. The next day she came back and bought the next customer in line, a complete stranger, her breakfast. She told us not to say anything until after she had left. People ARE awesome.",t3_4u89p9
40,d5o4si2,t3_4u89p9,"Looks like sometimes you really reap what you sow.  
Things like that really make me have some faith in humanity.",t3_4u89p9
41,d5od3ns,t3_4u89p9,"wow wtf a nice story?

this isn't what i expected

you have thrown me. i am thrown",t3_4u89p9
42,d5oowvq,t3_4u89p9,"Good for them. This year I started tipping a minimum of $10 for delivery, and I can't tell you how many times the drivers are shocked.

And that just makes me sad, because if you think about it, $10 really isn't that much.",t3_4u89p9
43,d70i9rt,t3_4u89p9,But is it Cold Stone Creamery or Marble Slab Creamery? I guess we'll never know.,t3_4u89p9
44,d5nnsqs,t3_4u89p9,I bet his mom made him do it,t3_4u89p9
45,d5npqrl,t3_4u89p9,Did you do the looniest song and dance of your career after he put $20 in the jar? ,t3_4u89p9
46,d5nvs9g,t3_4u89p9,[deleted],t3_4u89p9
47,d5nnuz3,t3_4u89p9,I was expecting him snitching on you but it all ended peacefully.,t3_4u89p9
48,d5np5hp,t3_4u89p9,"Went to a clothing store with a friend who had a Gift Card And no money and had the same thing happen cause of taxes. I was going to offer to spot him but the cashier was getting annoyed with him until he put back one item. It felt so awkward, but good for you. When you do nice things people repay them.",t3_4u89p9
49,d5nqdhy,t3_4u89p9,Maybe he felt guilty he actually had money the whole time,t3_4u89p9
50,d5nqsw1,t3_4u89p9,"You've heard about the seven circles of hell? Well, heaven has a nice plush lounge reserved for generous tippers.",t3_4u89p9
51,d5nryqx,t3_4u89p9,I too would give you $20 for XXX.,t3_4u89p9
52,d5nvkzy,t3_4u89p9,Do you have to sing a song backwards when you take money out of the tip jar at Cold Stone?,t3_4u89p9
53,d5ny2hc,t3_4u89p9,There are good customers out there.. somewhere.,t3_4u89p9
54,d5nyg46,t3_4u89p9,"The guys from the webcomic *Mac Hall* (now *Three Panel Soul*) had a booth at an Otakon (I think '06 or '07). I wanted to buy a shirt but they couldn't make change and so I ended up being short like $1 on a $30+ purchase. They let me have it anyway and said they hoped I'd get them the one dollar I was short when I could.

I managed to get someone to break a $20 into like two fives and singles and returned the dollar to them.

Every subsequent year I attended I carried $60+ in singles with me just in case I ever saw them again. I wanted to repay their kindness in a weird sort of way. I never managed to see them at a con again, though.",t3_4u89p9
55,d5nzqnl,t3_4u89p9,"Thats awesome. I also worked at a similar ice cream place. We would take the cash out of the tip jar before we got super busy so customers would think we weren't getting any tips.  
Anyway, I was the cone bitch for longer than I would care to admit. ",t3_4u89p9
56,d5nzsow,t3_4u89p9,His number is in the 20. He wants to fornicate.,t3_4u89p9
57,d5o0kqs,t3_4u89p9,You got him laid. He owed you.,t3_4u89p9
58,d5o1anm,t3_4u89p9,Makes you feel there's hope for the world after all :),t3_4u89p9
59,d5o92w0,t3_4u89p9,"This is the first positive story I saw on this subreddit, it made me happy thanks OP ",t3_4u89p9
60,d5oja1p,t3_4u89p9,"Is that why they call it coldstone?
",t3_4u89p9
61,d5oq5ae,t3_4u89p9,For a while I keep ignoring this story because I thought you were going to get hurt. I'm so happy it didn't end that way!!,t3_4u89p9
62,d5rqrr6,t3_4u89p9,"When I get a good waiter anywhere I go, whether that be friendly or does a good or even is really busy, I try to tip 40% for them. I may be able to see their reaction but I try to give a nice tip because it can make someone's day. And give them a morale boost to survive the day",t3_4u89p9
63,d61cju6,t3_4u89p9,"Wow, that's an awesome story. Some of my faith in humanity restored.",t3_4u89p9
64,d63kf7e,t3_4u89p9,"Have done that for quite a few customers , if only they were generous back",t3_4u89p9
65,d6u9tg5,t3_4u89p9,">So I used to work at an ice cream chain where we prepared the ice cream with various toppings on a frozen piece of rock.

Your retail hint is way too obvious man.",t3_4u89p9
66,d7ujge6,t3_4u89p9,I can respect that!!!,t3_4u89p9
67,d5nsg6v,t3_4u89p9,"the no eye contact at the end makes me think he told his parents and they went ""Ohh no they cant think we are poor"" and made him do it

I know far to many people like that",t3_4u89p9
68,d5nodoa,t3_4u89p9,See this is why (for the most part) I like teen or young adult shoppers. THEY GET IT! ,t3_4u89p9
69,d5nri94,t3_4u89p9,Well I got here too late...,t3_4u89p9
70,d5nvnfv,t3_4u89p9,/r/thathappend,t3_4u89p9
71,d5nnjuv,t3_4u89p9,Rarely see happy stories here...thanks!,t3_4u89p9
72,d5npcfo,t3_4u89p9,I totally came here expecting a story about a customer throwing a tantrum about how the change you returned to them was 36 cents short.  Good for those guys!,t3_4u89p9
73,d5npin5,t3_4u89p9,"and here I thought the other person you were working with was going to say, "" wtf whats $0.36 was not yours to give """,t3_4u89p9
74,d5nq8vm,t3_4u89p9,"Honestly, when the guy came back in I expected him to try to steal the tip jar hahah.",t3_4u89p9
75,d5nqbvp,t3_4u89p9,"At the coffee shop I work at, we just round the total up or down to the nearest nickel/dime/quarter for convenience. It averages out and there's a decent allowed margin for error so we can do stuff like that pretty often.",t3_4u89p9
76,d5nr1ix,t3_4u89p9,"I did the same thing once to a lesser extent. In college at my favorite place, i ordered food and was about $0.60 short and the guy took it out of the tip jar. Next night I returned and gave him $3 bc its all I had and said I know its not a lot but I want to tip you personally if thats possible",t3_4u89p9
77,d5nrcq8,t3_4u89p9,That Kid deserves an ice cream!,t3_4u89p9
78,d5nrn0v,t3_4u89p9,">removed

Aw, what did it say?!",t3_4u89p9
79,d5ns632,t3_4u89p9,on a frozen piece of... *rock*,t3_4u89p9
80,d5nsjor,t3_4u89p9,How nice. This made me smile.,t3_4u89p9
81,d5nsk3t,t3_4u89p9,Definitely not what I expected.,t3_4u89p9
82,d5nskuk,t3_4u89p9,/r/humansbeingbros,t3_4u89p9
83,d5nsqmz,t3_4u89p9,"Even though I like a good ""rude customer"" story, these are always welcomed. ",t3_4u89p9
84,d5nss9x,t3_4u89p9,mom or dad got wind of this story,t3_4u89p9
85,d5nsxc3,t3_4u89p9,I thought he would return and order another one but thats amazing ! Being awesome pays out sometimes :),t3_4u89p9
86,d5ntij7,t3_4u89p9,But why didn't he look at you when he returned with the tip?,t3_4u89p9
87,d5nu0vm,t3_4u89p9,"This post has made it to 5,000 up votes and has been posted on the twitter account @Reddit5000!
						
To see the tweet, check here: https://twitter.com/Reddit5000/status/756913038859436032

^You ^can ^find ^all ^5,000 ^posts ^here: ^https://twitter.com/Reddit5000

^, ^7,500 ^posts ^here: ^https://twitter.com/Reddit7500

^,And ^10,000 ^posts ^here: ^https://twitter.com/Reddit10000
						
^(I'm a bot, don't worry about supporting me (I don't cost much)^), ^(but you can support )[^charity](http://freethoughtpedia.com/wiki/Secular_charities) ^and [^science!](http://www.sens.org/)",t3_4u89p9
88,d5nu71i,t3_4u89p9,Could also be that his Mom or Dad made him go back,t3_4u89p9
89,d5nuciz,t3_4u89p9,Amazing story! What a nice surprise. Thanks for the smile.,t3_4u89p9
90,d5nudcm,t3_4u89p9,So we just have to trust this guys word? IDK IF I CAN,t3_4u89p9
91,d5nuie3,t3_4u89p9,"This is why I do strongly hold to the karma ideal. I have no disillusion that there is some mystic karmacal force residing over everyone, I just truly believe that if you make it a habit to inconvenience yourself slightly on a regular basis to make others and yourself happy, you will receive many times back your effort in return, so long as that's never the point of your actions. Never expecting rewards for your 0.1-1.0% inconvenience except for the subtle good feeling of an appreciative smile makes those times when people legitimately go out of their way to say thank feel so freaking good.",t3_4u89p9
92,d5nujc0,t3_4u89p9,Totally unexpected! ,t3_4u89p9
93,d5nurzl,t3_4u89p9,"I'd have done the same, not with a 20$ though.  
It's rare being on receiving end of kindness.",t3_4u89p9
94,d5nuxch,t3_4u89p9,unreal! :),t3_4u89p9
95,d5nuygg,t3_4u89p9,"This is why you never judge anyone!

I feel like there's **definitely** a stigma against younger customers. It's sad because they're the ones who are (almost always) extremely grateful when ever they're short money and you give them some.

It's funny... I really think everyone should work retail once in their lives just to know;

1. How it feels to be treated poorly so (hopefully) they won't do it to others.

2. Never judge anyone. Yeah that old man who always comes in and asks for you just to say hi... Yeah, he has been stealing from the store almost every time he comes in.",t3_4u89p9
96,d5nv3bz,t3_4u89p9,"First time a nice story from this sub has hit the front page. Not that I'm complaining--I like hearing horror stories about awful people from time to time, but this is a nice surprise!",t3_4u89p9
97,d5nv6ws,t3_4u89p9,"This is great

I was just this minute hearing about a friend of mine who got his nose broken by a taxi driver who upped the agreed fair by £10 on arrival.

Expected something terrible.

Hate to be that guy, but: faith in humanity restored.",t3_4u89p9
98,d5nvd96,t3_4u89p9,This is awesome!,t3_4u89p9
99,d5nvf8d,t3_4u89p9,">So I used to work at an ice cream chain where we prepared the ice cream with various toppings on a frozen piece of rock.

I'm dead",t3_4u89p9
100,d5nvfz1,t3_4u89p9,It is nice to here a positive story once in a while.,t3_4u89p9
101,d5nvig2,t3_4u89p9,"oh yay :) something like this happened when I was working at a southwestern-themed fast food joint. I worked register and a guy came in who forgot his wallet and didn't realize until he'd already had his food made, so I used my employee discount and paid for it. he came back later and handed me $10, which was more than the price of the food. I wasn't expecting that at all, I just didn't want this guy to not eat or to hold up the line (because that's when people start complaining to me like it's all my fault).",t3_4u89p9
102,d5nvjo2,t3_4u89p9,Good ole Janice The Butcher,t3_4u89p9
103,d5nvkhy,t3_4u89p9,"Damn... Assuming this kid doesn't have rich parents or a job, that's quite a lot of money for a high schooler. $20 was my entire weekly allowance back when I was in high school.",t3_4u89p9
104,d5nvu1m,t3_4u89p9,"That guy probably got laid or had a wonderful date. You made sure it went well, and he came to thank you because your probably made his friend really happy about the universe",t3_4u89p9
105,d5nw1g4,t3_4u89p9,I was expecting about tree fitty...,t3_4u89p9
106,d5nw53e,t3_4u89p9,"Good story. Unfortunately, the fact this story is so high because someone did something good is kinda sad because someone doing something good should be commonplace not the diamond in the rough.",t3_4u89p9
107,d5nwe33,t3_4u89p9,What a good ending. I'm so cynical I thought you were going to be fired for this.,t3_4u89p9
108,d5nweje,t3_4u89p9,Where can I get this giftcard? :),t3_4u89p9
109,d5nwg71,t3_4u89p9,"I once gave a guy who was broke down several bottles of water from my shop, it was a crazy hot day and it seemed like the decent thing to do.

Kid came back a week later and insisted on paying for all the water.  ",t3_4u89p9
110,d5nxcg9,t3_4u89p9,Awesome. ,t3_4u89p9
111,d5nxmtt,t3_4u89p9,Hmmm... Don't you have to sing if someone tips you at that particular ice cream chain?,t3_4u89p9
112,d5nxo42,t3_4u89p9,"Aww, how sweet ",t3_4u89p9
113,d5nxrse,t3_4u89p9,This is awesome!,t3_4u89p9
114,d5ny76m,t3_4u89p9,Reset qs,t3_4u89p9
115,d5nydqm,t3_4u89p9,"Awesome! I was half expecting a story where they expected the same treatment a second time. 

I sometimes pull change out of my own pocket to split a difference like that. I always see those people again another day =D ",t3_4u89p9
116,d5nyfd5,t3_4u89p9,Touching story but why didn't he look or talk to OP the second time? It's not embarrassing to come back and tip someone especially at that amount,t3_4u89p9
117,d5nyu0e,t3_4u89p9,A little faith in humanity was just restored,t3_4u89p9
118,d5nyvef,t3_4u89p9,What a legend,t3_4u89p9
119,d5nz31g,t3_4u89p9,Royalty never travel with cash...,t3_4u89p9
120,d5nz5tk,t3_4u89p9,I did not expect that ending. Good on ya!,t3_4u89p9
121,d5nzse8,t3_4u89p9,Hug that that story and that guy!,t3_4u89p9
122,d5o0z6x,t3_4u89p9,And then you had to sing!,t3_4u89p9
123,d5o11xr,t3_4u89p9,Faith in humanity restored!,t3_4u89p9
124,d5o16o0,t3_4u89p9,">So I used to work at an ice cream chain where we prepared the ice cream with various toppings on a frozen piece of rock.

You mean ""ChillyRock?"" ;)

Edit: Awww! What a nice guy! :)",t3_4u89p9
125,d5o1wtq,t3_4u89p9,This happened in an alternate univrese. Op PLEASE.,t3_4u89p9
126,d5o31ci,t3_4u89p9,Hopefully Karma does the opposite of a bitchslap with them. ,t3_4u89p9
127,d5o3rzp,t3_4u89p9,Did you sing?,t3_4u89p9
128,d5o3t65,t3_4u89p9,"¢, huh. Fancy! ",t3_4u89p9
129,d5oa021,t3_4u89p9,"I hope you sang them a fucking song for that tip haha. Man I miss working at the ""frozen rock"" ice cream place sometimes.",t3_4u89p9
130,d5oakta,t3_4u89p9,Do you think the kid's mom found out and gave him the 20 and he was embarrassed to have to go drop it in the tip jar? ,t3_4u89p9
131,d5ob67q,t3_4u89p9,Good things happen to good people :),t3_4u89p9
132,d5ocldc,t3_4u89p9,You put ice cream... on a frozen rock?  Is it a way to keep it cool longer?  My mind is full of wat and potential possibilities...,t3_4u89p9
133,d5od11z,t3_4u89p9,ah the good ole frozen rock place. Loved dropping by there on the train down to visit family. They really thought i went to see them...bwhahahaha,t3_4u89p9
134,d5oeal7,t3_4u89p9,"Many moons ago, I too worked at an ice cream chain; one with slightly more than 30 flavors...

A guy came in one day and ordered ice cream for himself and kid. went to pull his wallet out and it wasn't there.

I told him not to worry about it, pulled a 5 out of my pocket and covered the tab.

The next day he came in and gave me a $20.

On the flip side, I had a customer try to pay for her two blended coffee drinks with a Discover card once. We didn't take Discover. I told her I'd loan her the $7ish and she can pay me back next time. Never saw her again...but she told me her name was Karma... so, there's that...",t3_4u89p9
135,d5oehfb,t3_4u89p9,"Wow what an awesome dude
",t3_4u89p9
136,d5of2il,t3_4u89p9,Thought this was going to end way differently. ,t3_4u89p9
137,d5of9dv,t3_4u89p9,"> with various toppings on a frozen piece of rock

oh, so it wasn't on liquid hot magma?",t3_4u89p9
138,d5ojait,t3_4u89p9,I have a feeling he told his mom/dad what happened and they gave him the $20 and told him to go back.,t3_4u89p9
139,d5okiyn,t3_4u89p9,"I was expecting him to come back, take more from the tip jar and say ""I want the chocolate ice cream""",t3_4u89p9
140,d5okkpl,t3_4u89p9,That last part sounded like a weird interraction. Did you thank him? ,t3_4u89p9
141,d5pmqf8,t3_4u89p9,Wait...you have a tip jar at an ice cream store?,t3_4u89p9
142,d66y3bi,t3_4u89p9,you work at a cold rock? ,t3_4u89p9
143,dair512,t3_4u89p9,"This wouldn't happen to be Amy's Ice Cream in Texas, would it?",t3_4u89p9
144,d5nuv1f,t3_4u89p9,It's cold stone guys.,t3_4u89p9
145,d5nw5k1,t3_4u89p9,"And on the other hand, just yesterday I rang up a bill for $2.02 and the cashier flat-out refused to overlook the two pennies because it would ""come out of her paycheck.""

Not wanting 98c in change, I was about to leave, when her manager came by and said it was fine.

What is with people like this? Do they get off on the rush of authority or supposed moral high-ground of being superior to someone who doesn't happen to have two cents?",t3_4u89p9
146,d5nqh0f,t3_4u89p9,"Wait, where's the rude customer??",t3_4u89p9
147,d5ntbul,t3_4u89p9,Did you sing the tip song? ,t3_4u89p9
148,d5ntoge,t3_4u89p9,I was expecting loch Ness monstah,t3_4u89p9
149,d5nw6wy,t3_4u89p9,"So, did you sing? ",t3_4u89p9
150,d5o60vo,t3_4u89p9,I was expecting him to come back and pay the last 36c. What a gesture to come back and leave a tip like that. I will remember this story if I am ever in this situation one day. Thanks for the story! ,t3_4u89p9
